title,abstract,publication_year,keywords,mesh_terms,authors
Assessment of relationships between bullous pemphigoid and neurological diseases: A bidirectional two-sample Mendelian randomization study.,"Bullous pemphigoid (BP) is the most prevalent autoimmune vesiculobullous skin illness that tends to affect the elderly. Growing evidence has hinted a correlation between BP and neurological diseases. However, existing observational studies contained inconsistent results, and the causality and direction of their relationship remain poorly understood. To assess the causal relationship between BP and neurological disorders, including Alzheimer's disease (AD), multiple sclerosis (MS), Parkinson's disease (PD), and stroke. A bidirectional two-sample Mendelian randomization (MR) adopted independent top genetic variants as instruments from the largest accessible genome-wide association studies (GWASs), with BP (n = 218 348), PD (n = 482 730), AD (n = 63 926), stroke (n = 446 696), and MS (n = 115 803). Inverse variance weighted (IVW), MR-Egger, weighted mode methods, weighted median, and simple mode were performed to explore the causal association. Multiple sensitivity analyses, MR-Pleiotropy Residual Sum and Outlier (PRESSO) was used to evaluate horizontal pleiotropy and remove outliers. With close-to-zero effect estimates, no causal impact of BP on the risk of the four neurological diseases was discovered. However, we found that MS was positively correlated with higher odds of BP (OR = 1.220, 95% CI: 1.058-1.408, p = 0.006), while no causal associations were observed between PD (OR = 0.821, 95% CI: 0.616-1.093, p = 0.176), AD (OR = 1.066, 95% CI: 0.873-1.358, p = 0.603), stroke (OR = 0.911, 95% CI: 0.485-1.713, p = 0.773) and odds of BP. In summary, no causal impact of BP on the risk of PD, AD, MS and stroke was detected in our MR analysis. However, reverse MR analysis identified that only MS was positively correlated with higher odds of BP, but not PD, AD and stroke.",2024,Alzheimer's disease; Mendelian randomization; Parkinson's disease; bullous pemphigoid; multiple sclerosis; stroke,"Aged; Humans; Pemphigoid, Bullous; Genome-Wide Association Study; Mendelian Randomization Analysis; Nervous System Diseases; Parkinson Disease; Stroke","Shen, S; Chu, M; Miao, H; Li, L; Fang, H; Li, X; Zhu, Z; Bai, Y; Chen, J; Zhang, J; Shao, S; Dang, E; Zhang, C; Wang, G; Qiao, H"
A novel peptide 'T14' reflects age and photo-aging in human skin.,"T14 is a 14mer peptide derived from the C-terminus of acetylcholinesterase (AChE). Once cleaved, it is independently bioactive of the parent molecule and enhances calcium influx in different cell types, in a range of scenarios: it binds to an allosteric site selectively on the alpha-7 receptor, where it modulates calcium influx and is thus a potential trophic agent, as already reported in a range of normal developmental scenarios. However, if inappropriately activated, this erstwhile beneficial effect converts to a toxic one, resulting in pathologies as disparate as Alzheimer's and various metastatic cancers. Given that epidermal keratinocyte cells have the same ectodermal origin as brain cells, as well as expressing AChE and the alpha-7 receptor, we have explored whether T14 plays a comparable role. Here we report that the T14 immunoreactivity is detectable in human keratinocytes with levels inversely related to age: this decrease is even more apparent with chronic photo-exposure and thus accelerated skin aging. We conclude that T14, an agent promoting cell growth and renewal in other parts of the body, also operates in skin, Moreover, monitoring of keratinocyte T14 levels might offer further insights into the now well reported link between degenerative diseases and epidermal cell profile.",2023,acetylcholinesterase peptide; age; keratinocyte; photo-aging; skin,Humans; Skin Aging; Acetylcholinesterase; Peptide Fragments; Calcium; Peptides; Keratinocytes,"Rocha, S; Ratés, SG; Moswete, T; Kalleberg, K; Villa, A; Harcup, JP; Greenfield, SA"
Pooled analysis of frontal lobe transcriptomic data identifies key mitophagy gene changes in Alzheimer's disease brain.,"The growing prevalence of Alzheimer's disease (AD) is becoming a global health challenge without effective treatments. Defective mitochondrial function and mitophagy have recently been suggested as etiological factors in AD, in association with abnormalities in components of the autophagic machinery like lysosomes and phagosomes. Several large transcriptomic studies have been performed on different brain regions from AD and healthy patients, and their data represent a vast source of important information that can be utilized to understand this condition. However, large integration analyses of these publicly available data, such as AD RNA-Seq data, are still missing. In addition, large-scale focused analysis on mitophagy, which seems to be relevant for the aetiology of the disease, has not yet been performed.",2023,ARF1; Alzheimer's disease; GABARAPL1; VCP; lysosome; mitochondria; mitophagy; transcriptomics,,"Mei, T; Li, Y; Orduña Dolado, A; Li, Z; Andersson, R; Berliocchi, L; Rasmussen, LJ"
Development of a Definition of Postacute Sequelae of SARS-CoV-2 Infection.,"SARS-CoV-2 infection is associated with persistent, relapsing, or new symptoms or other health effects occurring after acute infection, termed postacute sequelae of SARS-CoV-2 infection (PASC), also known as long COVID. Characterizing PASC requires analysis of prospectively and uniformly collected data from diverse uninfected and infected individuals.",2023,,Female; Adult; Humans; Middle Aged; Male; SARS-CoV-2; COVID-19; Prospective Studies; Post-Acute COVID-19 Syndrome; Cohort Studies; Disease Progression; Fatigue,"Thaweethai, T; Jolley, SE; Karlson, EW; Levitan, EB; Levy, B; McComsey, GA; McCorkell, L; Nadkarni, GN; Parthasarathy, S; Singh, U; Walker, TA; Selvaggi, CA; Shinnick, DJ; Schulte, CCM; Atchley-Challenner, R; Alba, GA; Alicic, R; Altman, N; Anglin, K; Argueta, U; Ashktorab, H; Baslet, G; Bassett, IV; Bateman, L; Bedi, B; Bhattacharyya, S; Bind, MA; Blomkalns, AL; Bonilla, H; Brim, H; Bush, PA; Castro, M; Chan, J; Charney, AW; Chen, P; Chibnik, LB; Chu, HY; Clifton, RG; Costantine, MM; Cribbs, SK; Davila Nieves, SI; Deeks, SG; Duven, A; Emery, IF; Erdmann, N; Erlandson, KM; Ernst, KC; Farah-Abraham, R; Farner, CE; Feuerriegel, EM; Fleurimont, J; Fonseca, V; Franko, N; Gainer, V; Gander, JC; Gardner, EM; Geng, LN; Gibson, KS; Go, M; Goldman, JD; Grebe, H; Greenway, FL; Habli, M; Hafner, J; Han, JE; Hanson, KA; Heath, J; Hernandez, C; Hess, R; Hodder, SL; Hoffman, MK; Hoover, SE; Huang, B; Hughes, BL; Jagannathan, P; John, J; Jordan, MR; Katz, SD; Kaufman, ES; Kelly, JD; Kelly, SW; Kemp, MM; Kirwan, JP; Klein, JD; Knox, KS; Krishnan, JA; Kumar, A; Laiyemo, AO; Lambert, AA; Lanca, M; Lee-Iannotti, JK; Logarbo, BP; Longo, MT; Luciano, CA; Lutrick, K; Maley, JH; Mallett, G; Marathe, JG; Marconi, V; Marshall, GD; Martin, CF; Matusov, Y; Mehari, A; Mendez-Figueroa, H; Mermelstein, R; Metz, TD; Morse, R; Mosier, J; Mouchati, C; Mullington, J; Murphy, SN; Neuman, RB; Nikolich, JZ; Ofotokun, I; Ojemakinde, E; Palatnik, A; Palomares, K; Parimon, T; Parry, S; Patterson, JE; Patterson, TF; Patzer, RE; Peluso, MJ; Pemu, P; Pettker, CM; Plunkett, BA; Pogreba-Brown, K; Poppas, A; Quigley, JG; Reddy, U; Reece, R; Reeder, H; Reeves, WB; Reiman, EM; Rischard, F; Rosand, J; Rouse, DJ; Ruff, A; Saade, G; Sandoval, GJ; Santana, JL; Schlater, SM; Sciurba, FC; Shepherd, F; Sherif, ZA; Simhan, H; Singer, NG; Skupski, DW; Sowles, A; Sparks, JA; Sukhera, FI; Taylor, BS; Teunis, L; Thomas, RJ; Thorp, JM; Thuluvath, P; Ticotsky, A; Tita, AT; Tuttle, KR; Urdaneta, AE; Valdivieso, D; VanWagoner, TM; Vasey, A; Verduzco-Gutierrez, M; Wallace, ZS; Ward, HD; Warren, DE; Weiner, SJ; Welch, S; Whiteheart, SW; Wiley, Z; Wisnivesky, JP; Yee, LM; Zisis, S; Horwitz, LI; Foulkes, AS"
Roles of Dihydrolipoamide Dehydrogenase in Health and Disease.,,2023,BN-PAGE; dihydrolipoamide dehydrogenase; metabolic disease; mitochondria; oxidative stress; redox,Animals; Humans; Dihydrolipoamide Dehydrogenase; Stroke; Oxidation-Reduction,"Yan, LJ; Wang, Y"
Developing Biomarkers for the Skin: Biomarkers for the Diagnosis and Prediction of Treatment Outcomes of Alzheimer's Disease.,"Alzheimer's disease (AD) is a neurodegenerative disorder characterized by memory decline and cognitive impairment. Research on biomarkers can aid in early diagnosis, monitoring disease progression, evaluating treatment efficacy, and advancing fundamental research. We conducted a cross-sectional longitudinal study to see if there is an association between AD patients and age-matched healthy controls for their physiologic skin characteristics, such as pH, hydration, transepidermal water loss (TEWL), elasticity, microcirculation, and ApoE genotyping. The study used the Mini-Mental State Examination (MMSE) and Clinical Dementia Rating-Sum of the Boxes (CDR-SB) scales as references to quantify the presence of disease, if any. Our findings demonstrate that AD patients have a dominantly neutral pH, greater skin hydration, and less elasticity compared to the control subjects. At baseline, the tortuous capillary percentage negatively correlated with MMSE scores in AD patients. However, AD patients who carry the ApoE E4 allele and exhibit a high percentage of tortuous capillaries and capillary tortuous numbers have shown better treatment outcomes at six months. Therefore, we believe that physiologic skin testing is a rapid and effective way to screen, monitor progression, and ultimately guide the most appropriate treatment for AD patients.",2023,Alzheimer’s disease (AD); ApoE genotype; biomarker; capillary microscopy; capillary tortuosity; elasticity; non-invasive diagnosis; pH level; prognosis; skin hydration; skin physiological test,Humans; Alzheimer Disease; Longitudinal Studies; Cross-Sectional Studies; Treatment Outcome; Apolipoproteins E; Cognitive Dysfunction; Biomarkers; Disease Progression; Neuropsychological Tests,"Wu, CY; Ho, CY; Yang, YH"
A New Generation of IMiDs as Treatments for Neuroinflammatory and Neurodegenerative Disorders.,"The immunomodulatory imide drug (IMiD) class, which includes the founding drug member thalidomide and later generation drugs, lenalidomide and pomalidomide, has dramatically improved the clinical treatment of specific cancers, such as multiple myeloma, and it combines potent anticancer and anti-inflammatory actions. These actions, in large part, are mediated by IMiD binding to the human protein cereblon that forms a critical component of the E3 ubiquitin ligase complex. This complex ubiquitinates and thereby regulates the levels of multiple endogenous proteins. However, IMiD-cereblon binding modifies cereblon's normal targeted protein degradation towards a new set of neosubstrates that underlies the favorable pharmacological action of classical IMiDs, but also their adverse actions-in particular, their teratogenicity. The ability of classical IMiDs to reduce the synthesis of key proinflammatory cytokines, especially TNF-α levels, makes them potentially valuable to reposition as drugs to mitigate inflammatory-associated conditions and, particularly, neurological disorders driven by an excessive neuroinflammatory element, as occurs in traumatic brain injury, Alzheimer's and Parkinson's diseases, and ischemic stroke. The teratogenic and anticancer actions of classical IMiDs are substantial liabilities for effective drugs in these disorders and can theoretically be dialed out of the drug class. We review a select series of novel IMiDs designed to avoid binding with human cereblon and/or evade degradation of downstream neosubstrates considered to underpin the adverse actions of thalidomide-like drugs. These novel non-classical IMiDs hold potential as new medications for erythema nodosum leprosum (ENL), a painful inflammatory skin condition associated with Hansen's disease for which thalidomide remains widely used, and, in particular, as a new treatment strategy for neurodegenerative disorders in which neuroinflammation is a key component.",2023,Alzheimer’s disease; Parkinson’s disease; cereblon; erythema nodosum leprosum; immunomodulatory imide drugs (IMiDs); neurodegeneration; neuroinflammation; pomalidomide; thalidomide; traumatic brain injury,Humans; Thalidomide; Immunomodulating Agents; Neuroinflammatory Diseases; Multiple Myeloma; Ubiquitin-Protein Ligases; Neurodegenerative Diseases,"Kopp, KO; Greer, ME; Glotfelty, EJ; Hsueh, SC; Tweedie, D; Kim, DS; Reale, M; Vargesson, N; Greig, NH"
Diversified cassane family diterpenoids from the leaves of Caesalpinia minax exerting anti-neuroinflammatory activity through suppressing MAPK and NF-κB pathways in BV-2 microglia.,"Caesalpinia minax Hance, whose seeds are known as ""Ku-shi-lian"" in China, have been used in Chinese folk medicine for treatment of rheumatism, dysentery, and skin itching. However, the anti-neuroinflammatory constituents of its leaves and their mechanism are rarely reported.",2023,Anti-neuroinflammatory activity; Cassane diterpenoids; MAPK; NF-κB; Neurodegenerative diseases,NF-kappa B; Caesalpinia; Microglia; Cyclooxygenase 2; Molecular Docking Simulation; Anti-Inflammatory Agents; Plant Leaves; Diterpenes; Lipopolysaccharides,"Lu, W; Chen, JT; Shi, YF; Chen, MS; Wang, PP; Zhang, XJ; Xiao, CJ; Li, D; Cao, CY; Li, CH; Gao, JM"
Signatures of Neuropsychological Test Results in the Long Life Family Study: A Cluster Analysis.,Discovering patterns of cognitive domains and characterizing how these patterns associate with other risk factors and biomarkers can improve our understanding of the determinants of cognitive aging.,2023,Aging; Alzheimer’s disease; cluster analysis; cognition; longevity; neuropsychology; survival,"Aged, 80 and over; Female; Humans; Male; Bayes Theorem; Biomarkers; Cardiovascular Diseases; Cluster Analysis; Cognition; Cognitive Aging; Cognitive Dysfunction; Dementia; Family Health; Holistic Health; Longevity; Multifactorial Inheritance; Neuropsychological Tests; Skin Neoplasms; Aged; Middle Aged","Xiang, Q; Andersen, SL; Sweigart, B; Gunn, S; Nygaard, M; Perls, TT; Sebastiani, P"
Lavender Plant: Farming and Health Benefits.,"Natural remedies from a range of sources, including plants, animals, microorganisms, and marine life, have made a significant contribution to the treatment of many ailments. Lavender is a Mediterranean shrub from the Lamiaceae family. Lavender flowers (Lavandula flores) include active ingredients (3%), anthocyanins, sugars, phytosterols, minerals, and tannins and are majorly used for herbal applications. Lavender essential oil's descriptive and analytical composition varies depending on genotype, growing region, climatic circumstances, propagation, and morphological characteristics. There are around 300 chemical components in essential oil. Linalool, terpinen-4-ol, linalyl acetate, ocimene, acetate lavandulol, and cineole are the most prominent constituents. Lavender oil has antibacterial and antioxidant properties. The lavender extract helps to prevent dementia and may slow cancer cell growth, while lavender oil is used to treat skin problems. This review will cover the recent medical, economic and regional advancements in levander propagation and how the Council of Scientific & Industrial Research Indian Institute of Integrative (CSIR IIIM) aroma mission is actively acting as a bridge between farmers and their economic improvement by attracting them to the field of medicinal plant cultivation.",2024,Lavender; alzheimer's disease; autophagy.; cancer; depression; essential oil,"Lavandula; Humans; Oils, Volatile; Plant Oils; Plants, Medicinal; Animals; Agriculture; Antioxidants","Khan, SU; Hamza, B; Mir, RH; Fatima, K; Malik, F"
Increased Risk of Dementia in Patients with Atopic Dermatitis: A Nationwide Population-Based Cohort Study.,"Atopic dermatitis (AD) is a chronic inflammatory skin disorder with bimodal incidence peaks in early childhood and middle-aged and older adults. Few studies have focused on the risk of dementia in AD. The aims of this study were to analyse the incidence, and risk factors for dementia in patients with AD. This nationwide population-based retrospective cohort study enrolled 38,391 adults ≥ 40 years of age with AD and 2,643,602 controls without AD from the Korean National Health Insurance System (NHIS) database from 2009 to 2016. The cumulative incidence probability of all-cause dementia, Alzheimer's disease, or vascular dementia at 8 years was 50, 39, and 7 per 1,000 person-years in patients with AD, respectively. The adjusted risks of all-cause dementia (hazard ratio (HR), 1.072; 95% confidence interval (95% CI) 1.026-1.120), and Alzheimer's disease (HR 1.051; 95% CI 1.000-1.104) were increased in patients with AD. The effect of AD on the development of all-cause dementia and Alzheimer's dementia varied according to age and diabetes mellitus (all p for interaction, < 0.05). The risks of all-cause dementia and Alzheimer's disease were increased in patients with AD. Management of modifiable risk factors is important for preventing dementia in patients with AD.",2023,,"Middle Aged; Humans; Child, Preschool; Aged; Alzheimer Disease; Retrospective Studies; Cohort Studies; Dermatitis, Atopic; Risk Factors; Incidence","Woo, YR; Cho, M; Han, KD; Cho, SH; Lee, JH"
"Aluminium in the Human Brain: Routes of Penetration, Toxicity, and Resulting Complications.","Aluminium (Al) is the most ubiquitous metal in the Earth's crust. Even though its toxicity is well-documented, the role of Al in the pathogenesis of several neurological diseases remains debatable. To establish the basic framework for future studies, we review literature reports on Al toxicokinetics and its role in Alzheimer's disease (AD), autism spectrum disorder (ASD), alcohol use disorder (AUD), multiple sclerosis (MS), Parkinson's disease (PD), and dialysis encephalopathy (DE) from 1976 to 2022. Despite poor absorption via mucosa, the biggest amount of Al comes with food, drinking water, and inhalation. Vaccines introduce negligible amounts of Al, while the data on skin absorption (which might be linked with carcinogenesis) is limited and requires further investigation. In the above-mentioned diseases, the literature shows excessive Al accumulation in the central nervous system (AD, AUD, MS, PD, DE) and epidemiological links between greater Al exposition and their increased prevalence (AD, PD, DE). Moreover, the literature suggests that Al has the potential as a marker of disease (AD, PD) and beneficial results of Al chelator use (such as cognitive improvement in AD, AUD, MS, and DE cases).",2023,Alzheimer’s disease; Parkinson’s disease; alcohol use disorder; aluminium; autism spectrum disorder; dialysis encephalopathy; human brain; multiple sclerosis,Humans; Aluminum; Autism Spectrum Disorder; Brain; Alzheimer Disease; Central Nervous System; Parkinson Disease; Multiple Sclerosis,"Bryliński, Ł; Kostelecka, K; Woliński, F; Duda, P; Góra, J; Granat, M; Flieger, J; Teresiński, G; Buszewicz, G; Sitarz, R; Baj, J"
The clinical characteristics of neuronal intranuclear inclusion disease and its relation with inflammation.,"Neuronal intranuclear inclusion disease (NIID) is a great imitator with a broad spectrum of clinical manifestations that include dementia, parkinsonism, paroxysmal symptoms, peripheral neuropathy, and autonomic dysfunction. Hence, it may also masquerade as other diseases such as Alzheimer's disease, Parkinson's disease, and Charcot-Marie-Tooth disease. Recent breakthroughs on neuroimaging, skin biopsy, and genetic testing have facilitated the diagnosis. However, early identification and effective treatment are still difficult in cases of NIID.",2023,Inflammation; NOTCH2NLC; Neuronal intranuclear inclusion disease; Symptoms,Humans; Intranuclear Inclusion Bodies; Inflammation; Alzheimer Disease; Stroke,"Yan, Y; Cao, L; Gu, L; Xu, C; Fang, W; Tian, J; Yin, X; Zhang, B; Zhao, G"
Cellular heterogeneity and stem cells of vascular endothelial cells in blood vessel formation and homeostasis: Insights from single-cell RNA sequencing.,"Vascular endothelial cells (ECs) that constitute the inner surface of blood vessels are essential for new vessel formation and organ homeostasis. ECs display remarkable phenotypic heterogeneity across different organs and the vascular tree during angiogenesis and homeostasis. Recent advances in single cell RNA sequencing (scRNA-seq) technologies have allowed a new understanding of EC heterogeneity in both mice and humans. In particular, scRNA-seq has identified new molecular signatures for arterial, venous and capillary ECs in different organs, as well as previously unrecognized specialized EC subtypes, such as the aerocytes localized in the alveolar capillaries of the lung. scRNA-seq has also revealed the gene expression profiles of specialized tissue-resident EC subtypes that are capable of clonal expansion and contribute to adult angiogenesis, a process of new vessel formation from the pre-existing vasculature. These specialized tissue-resident ECs have been identified in various different mouse tissues, including aortic endothelium, liver, heart, lung, skin, skeletal muscle, retina, choroid, and brain. Transcription factors and signaling pathways have also been identified in the specialized tissue-resident ECs that control angiogenesis. Furthermore, scRNA-seq has also documented responses of ECs in diseases such as cancer, age-related macular degeneration, Alzheimer's disease, atherosclerosis, and myocardial infarction. These new findings revealed by scRNA-seq have the potential to provide new therapeutic targets for different diseases associated with blood vessels. In this article, we summarize recent advances in the understanding of the vascular endothelial cell heterogeneity and endothelial stem cells associated with angiogenesis and homeostasis in mice and humans, and we discuss future prospects for the application of scRNA-seq technology.",2023,"CD157/Bst1, pathological angiogenesis; angiogenesis; clonal expansion; heterogeneity; single-cell RNA sequencing; vascular endothelial cells (VECs); vascular endothelial stem cells",,"Wakabayashi, T; Naito, H"
,,2023,Acori tatarinowii rhizoma; chemical composition; pharmacokinetics; pharmacology; review; toxicity,,"Wen, J; Yang, Y; Hao, J"
Review on Carbon Dot-Based Fluorescent Detection of Biothiols.,"Biothiols, such as cysteine (Cys), homocysteine (Hcy), and glutathione (GSH), play a vital role in gene expression, maintaining redox homeostasis, reducing damages caused by free radicals/toxins, etc. Likewise, abnormal levels of biothiols can lead to severe diseases, such as Alzheimer's disease (AD), neurotoxicity, hair depigmentation, liver/skin damage, etc. To quantify the biothiols in a biological system, numerous low-toxic probes, such as fluorescent quantum dots, emissive organic probes, composited nanomaterials, etc., have been reported with real-time applications. Among these fluorescent probes, carbon-dots (CDs) have become attractive for biothiols quantification because of advantages of easy synthesis, nano-size, crystalline properties, low-toxicity, and real-time applicability. A CDs-based biothiols assay can be achieved by fluorescent ""Turn-On"" and ""Turn-Off"" responses via direct binding, metal complex-mediated detection, composite enhanced interaction, reaction-based reports, and so forth. To date, the availability of a review focused on fluorescent CDs-based biothiols detection with information on recent trends, mechanistic aspects, linear ranges, LODs, and real applications is lacking, which allows us to deliver this comprehensive review. This review delivers valuable information on reported carbon-dots-based biothiols assays, the underlying mechanism, their applications, probe/CDs selection, sensory requirement, merits, limitations, and future scopes.",2023,bioassay; bioimaging; biothiols detection; carbon-dots; complex-mediated sensors; fluorescence; fluorescence quenching; nanocomposites; one-pot synthesis; real analysis,"Sulfhydryl Compounds; Carbon; Cysteine; Fluorescent Dyes; Quantum Dots; Glutathione; Spectrometry, Fluorescence","Shellaiah, M; Sun, KW"
"Sleep matters: Neurodegeneration spectrum heterogeneity, combustion and friction ultrafine particles, industrial nanoparticle pollution, and sleep disorders-Denial is not an option.",Sustained exposures to ubiquitous outdoor/indoor fine particulate matter (PM,2023,Alzheimer's; OSA; PM2.5; air pollution; depression; nanoneuropathology; nanoparticles; sleep disorders RBD,,"Calderón-Garcidueñas, L; Torres-Jardón, R; Greenough, GP; Kulesza, R; González-Maciel, A; Reynoso-Robles, R; García-Alonso, G; Chávez-Franco, DA; García-Rojas, E; Brito-Aguilar, R; Silva-Pereyra, HG; Ayala, A; Stommel, EW; Mukherjee, PS"
