title,abstract,publication_year,keywords,mesh_terms,authors
Cortical thickness is related to cognitive-motor automaticity and attention allocation in individuals with Alzheimer's disease: a regions of interest study.,"Alzheimer's disease (AD) is characterized by a distinct pattern of cortical thinning and resultant changes in cognition and function. These result in prominent deficits in cognitive-motor automaticity. The relationship between AD-related cortical thinning and decreased automaticity is not well-understood. We aimed to investigate the relationship between cortical thickness regions-of-interest (ROI) and automaticity and attention allocation in AD using hypothesis-driven and exploratory approaches. We performed an ROI analysis of 46 patients with AD. Data regarding MR images, demographic characteristics, cognitive-motor dual task performance, and cognition were extracted from medical records. Cortical thickness was calculated from MR T1 images using FreeSurfer. Data from the dual task assessment was used to calculate the combined dual task effect (cDTE), a measure of cognitive-motor automaticity, and the modified attention allocation index (mAAI). Four hierarchical multiple linear regression models were conducted regressing cDTE and mAAI separately on (1) hypothesis-generated ROIs and (2) exploratory ROIs. For cDTE, cortical thicknesses explained 20.5% (p = 0.014) and 25.9% (p = 0.002) variability in automaticity in the hypothesized ROI and exploratory models, respectively. The dorsal lateral prefrontal cortex (DLPFC) (β =  - 0.479, p = 0.018) and superior parietal cortex (SPC) (β = 0.467, p = 0.003), and were predictors of automaticity. For mAAI, cortical thicknesses explained 20.7% (p = 0.025) and 28.3% (p = 0.003) variability in attention allocation in the hypothesized ROI and exploratory models, respectively. Thinning of SPC and fusiform gyrus were associated with motor prioritization (β =  - 0.405, p = 0.013 and β =  - 0.632, p = 0.004, respectively), whereas thinning of the DLPFC was associated with cognitive prioritization (β = 0.523, p = 0.022). Cortical thinning in AD was related to cognitive-motor automaticity and task prioritization, particularly in the DLPFC and SPC. This suggests that these regions may play a primary role in automaticity and attentional strategy during dual-tasking.",2023,Alzheimer’s disease; Automaticity; Cognitive-motor interference; Dual task interference; Prefrontal cortex; Superior parietal cortex,Humans; Alzheimer Disease; Cerebral Cortex; Cadmium Compounds; Cerebral Cortical Thinning; Magnetic Resonance Imaging; Quantum Dots; Tellurium; Cognition; Attention,"Longhurst, JK; Sreenivasan, KR; Kim, J; Cummings, JL; John, SE; Poston, B; Cordes, D; Rider, JV; Landers, MR"
Effects of storage conditions on the stability of blood-based markers for the diagnosis of Alzheimer's disease.,"Alzheimer's disease (AD) is considered the most common cause of dementia in older people. Recently, blood-based markers (BBM) Aβ1-42, Aβ1-40, and phospho Tau181 (p-Tau181) have demonstrated the potential to transform the diagnosis and prognostic assessment of AD. Our aim was to investigate the effect of different storage conditions on the quantification of these BBM and to evaluate the interchangeability of plasma and serum samples.",2023,Alzheimer’s disease; amyloid; automated platforms; blood-based markers; plasma; preanalytical phase; serum; tau,Humans; Aged; Alzheimer Disease; tau Proteins; Amyloid beta-Peptides; Retrospective Studies; Biomarkers,"Mansilla, A; Canyelles, M; Ferrer, R; Arranz, J; Rodríguez-Baz, Í; Zhu, N; Rubio-Guerra, S; El Bounasri, S; Sánchez, O; Torres, S; Fortea, J; Lleó, A; Alcolea, D; Tondo, M"
Age-related and amyloid-beta-independent tau deposition and its downstream effects.,"Amyloid-β (Aβ) is hypothesized to facilitate the spread of tau pathology beyond the medial temporal lobe. However, there is evidence that, independently of Aβ, age-related tau pathology might be present outside of the medial temporal lobe. We therefore aimed to study age-related Aβ-independent tau deposition outside the medial temporal lobe in two large cohorts and to investigate potential downstream effects of this on cognition and structural measures. We included 545 cognitively unimpaired adults (40-92 years) from the BioFINDER-2 study (in vivo) and 639 (64-108 years) from the Rush Alzheimer's Disease Center cohorts (ex vivo). 18F-RO948- and 18F-flutemetamol-PET standardized uptake value ratios were calculated for regional tau and global/regional Aβ in vivo. Immunohistochemistry was used to estimate Aβ load and tangle density ex vivo. In vivo medial temporal lobe volumes (subiculum, cornu ammonis 1) and cortical thickness (entorhinal cortex, Brodmann area 35) were obtained using Automated Segmentation for Hippocampal Subfields packages. Thickness of early and late neocortical Alzheimer's disease regions was determined using FreeSurfer. Global cognition and episodic memory were estimated to quantify cognitive functioning. In vivo age-related tau deposition was observed in the medial temporal lobe and in frontal and parietal cortical regions, which was statistically significant when adjusting for Aβ. This was also observed in individuals with low Aβ load. Tau deposition was negatively associated with cortical volumes and thickness in temporal and parietal regions independently of Aβ. The associations between age and cortical volume or thickness were partially mediated via tau in regions with early Alzheimer's disease pathology, i.e. early tau and/or Aβ pathology (subiculum/Brodmann area 35/precuneus/posterior cingulate). Finally, the associations between age and cognition were partially mediated via tau in Brodmann area 35, even when including Aβ-PET as covariate. Results were validated in the ex vivo cohort showing age-related and Aβ-independent increases in tau aggregates in and outside the medial temporal lobe. Ex vivo age-cognition associations were mediated by medial and inferior temporal tau tangle density, while correcting for Aβ density. Taken together, our study provides support for primary age-related tauopathy even outside the medial temporal lobe in vivo and ex vivo, with downstream effects on structure and cognition. These results have implications for our understanding of the spreading of tau outside the medial temporal lobe, also in the context of Alzheimer's disease. Moreover, this study suggests the potential utility of tau-targeting treatments in primary age-related tauopathy, likely already in preclinical stages in individuals with low Aβ pathology.",2023,MRI; PART; ageing; amyloid-beta; autoradiography; medial temporal lobe subregions; tau-PET imaging,Adult; Humans; Alzheimer Disease; tau Proteins; Cognitive Dysfunction; Amyloid beta-Peptides; Tauopathies; Positron-Emission Tomography; Magnetic Resonance Imaging,"Wuestefeld, A; Pichet Binette, A; Berron, D; Spotorno, N; van Westen, D; Stomrud, E; Mattsson-Carlgren, N; Strandberg, O; Smith, R; Palmqvist, S; Glenn, T; Moes, S; Honer, M; Arfanakis, K; Barnes, LL; Bennett, DA; Schneider, JA; Wisse, LEM; Hansson, O"
"Cognitive performance in healthy clinical trial participants and patients with the NeuroCart, a neurodegenerative disease measured with an automated neuropsychological and neurophysiological test battery.","The prevalence of neurodegenerative diseases increases significantly with increasing age. Neurodegeneration is the progressive loss of function of neurons that eventually leads to cell death, which in turn leads to cognitive disfunction. Cognitive performance can therefore also be considered age dependent. The current study investigated if the NeuroCart can detect age related decline on drug-sensitive CNS-tests in healthy volunteers (HV), and whether there are interactions between the rates of decline and sex. This study also investigated if the NeuroCart was able to differentiate disease profiles of neurodegenerative diseases, compared to age-matched HV and if there is age related decline in patient groups.",2023,Age related cognitive decline; Alzheimer's disease; Cognition; Huntington's disease; Neurodegeneration; Parkinson's disease; Vascular dementia,"Humans; Male; Female; Neurodegenerative Diseases; Retrospective Studies; Neuropsychological Tests; Alzheimer Disease; Parkinson Disease; Huntington Disease; Dementia, Vascular; Cognition","Prins, S; Borghans, L; de Kam, ML; Groeneveld, GJ; van Gerven, J"
The current state of artificial intelligence-augmented digitized neurocognitive screening test.,"The cognitive screening test is a brief cognitive examination that could be easily performed in a clinical setting. However, one of the main drawbacks of this test was that only a paper-based version was available, which restricts the test to be manually administered and graded by medical personnel at the health centers. The main solution to these problems was to develop a potential remote assessment for screening individuals with cognitive impairment. Currently, multiple studies have been adopting artificial intelligence (AI) technology into these tests, evolving the conventional paper-based neurocognitive test into a digitized AI-assisted neurocognitive test. These studies provided credible evidence of the potential of AI-augmented cognitive screening tests to be better and provided the framework for future studies to further improve the implementation of AI technology in the cognitive screening test. The objective of this review article is to discuss different types of AI used in digitized cognitive screening tests and their advantages and disadvantages.",2023,artificial intelligence; automated speech recognition; cognitive assessment; computer vision; computerized screening test; dementia; machine learning,,"Sirilertmekasakul, C; Rattanawong, W; Gongvatana, A; Srikiatkhachorn, A"
Predicting delirium in older non-intensive care unit inpatients: development and validation of the DELIrium risK Tool (DELIKT).,Effective delirium prevention could benefit from automatic risk stratification of older inpatients using routinely collected clinical data.,2023,Adverse effects; Aged; Cholinergic antagonists; Clinical decision rules; Delirium,"Humans; Aged; Aged, 80 and over; Delirium; Inpatients; Hospitalization; Intensive Care Units; Cholinergic Antagonists","Schulthess-Lisibach, AE; Gallucci, G; Benelli, V; Kälin, R; Schulthess, S; Cattaneo, M; Beeler, PE; Csajka, C; Lutters, M"
3d Virtual Histology Reveals Pathological Alterations of Cerebellar Granule Cells in Multiple Sclerosis.,"We investigate structural properties of neurons in the granular layer of human cerebellum with respect to their involvement in multiple sclerosis (MS). To this end we analyze data recorded by X-ray phase contrast tomography from tissue samples collected post mortem from a MS and a healthy control group. Using automated segmentation and histogram analysis based on optimal transport theory (OT) we find that the distributions representing nuclear structure in the granular layer move to a more compact nuclear state, i.e. smaller, denser and more heterogeneous nuclei in MS. We have previously made a similar observation for neurons of the dentate gyrus in Alzheimer's disease, suggesting that more compact structure of neuronal nuclei which we attributed to increased levels of heterochromatin, may possibly represent a more general phenomenon of cellular senescence associated with neurodegeneration.",2023,X-ray phase contrast tomography; granule cells; multiple sclerosis; optimal transport,Humans; Multiple Sclerosis; Neurons; Cerebellum; Cellular Senescence; Alzheimer Disease,"Frost, J; Schmitzer, B; Töpperwien, M; Eckermann, M; Franz, J; Stadelmann, C; Salditt, T"
Automatic and manual segmentation of the piriform cortex: Method development and validation in patients with temporal lobe epilepsy and Alzheimer's disease.,"The piriform cortex (PC) is located at the junction of the temporal and frontal lobes. It is involved physiologically in olfaction as well as memory and plays an important role in epilepsy. Its study at scale is held back by the absence of automatic segmentation methods on MRI. We devised a manual segmentation protocol for PC volumes, integrated those manually derived images into the Hammers Atlas Database (n = 30) and used an extensively validated method (multi-atlas propagation with enhanced registration, MAPER) for automatic PC segmentation. We applied automated PC volumetry to patients with unilateral temporal lobe epilepsy with hippocampal sclerosis (TLE; n = 174 including n = 58 controls) and to the Alzheimer's Disease Neuroimaging Initiative cohort (ADNI; n = 151, of whom with mild cognitive impairment (MCI), n = 71; Alzheimer's disease (AD), n = 33; controls, n = 47). In controls, mean PC volume was 485 mm",2023,Hammers Atlas Database; MAPER; hippocampal sclerosis; mild cognitive impairment; morphometry,"Humans; Alzheimer Disease; Epilepsy, Temporal Lobe; Hippocampus; Piriform Cortex; Magnetic Resonance Imaging; Atrophy","Steinbart, D; Yaakub, SN; Steinbrenner, M; Guldin, LS; Holtkamp, M; Keller, SS; Weber, B; Rüber, T; Heckemann, RA; Ilyas-Feldmann, M; Hammers, A"
Use of the electronic medical record to screen for high-risk geriatric patients in the emergency department.,"Older adults with multimorbidities have the highest rate of emergency department (ED) usage. These patients are typically on numerous medications, may have underlying dementia, and often present with falls and delirium. Identifying these high-risk older adults for possible intervention is challenging in the ED setting since available screening methods are manual and resource-intensive. The objective is to study the electronic medical record (EMR) use for identifying high-risk older adults in ED. This feasibility study is conducted in an academic ED with 67 000 total and 24% geriatric (age ≥ 65 years) annual visits, American College of Emergency Physician (ACEP) accredited Level 1 Geriatric Emergency Department with an ED-based geriatric consultation program by incorporating criteria from existing manual geriatric screening instruments and the 4M framework into an automated EMR screen to identify high-risk geriatric patients. ED providers are then alerted by an EMR Best Practice Alert (BPA) if high-risk status is identified. Initial development and impact on geriatric ED consults are reported. During the study period, 7450 patient encounters occurred; 1836 (24.6%) encounters involved patients who were 65 years or older. A total of 1398 (76.1%) high-risk ED encounters resulted in BPA alerts using the EMR automated screen. BPA alerts resulted in 82 (5.9%) geriatric evaluations. We conclude that using the EMR to automate screening for older adults for high-risk geriatric conditions in the ED is feasible. An automated EMR screen with a BPA to ED providers identified a well-defined cohort of older patients appropriate for further ED geriatric evaluation.",2023,automated screening; electronic medical record; geriatric emergency department,,"Saxena, S; Meldon, S; Hashmi, AZ; Muir, M; Ruwe, J"
Evaluating the feasibility of cognitive impairment detection in Alzheimer's disease screening using a computerized visual dynamic test.,"Alzheimer's disease (AD) is a neurodegenerative disease without known cure. However, early medical treatment can help control its progression and postpone intellectual decay. Since AD is preceded by a period of cognitive deterioration, the effective assessment of cognitive capabilities is crucial to develop reliable screening procedures. For this purpose, cognitive tests are extensively used to evaluate cognitive areas such as language, attention, or memory.",2023,Alzheimer’s disease; Cognitive tests; Screening; Visual dynamics,Humans; Alzheimer Disease; Neurodegenerative Diseases; Feasibility Studies; Cognitive Dysfunction; Cognition Disorders; Neuropsychological Tests,"Perez-Valero, E; Gutierrez, CAM; Lopez-Gordo, MA; Alcalde, SL"
Volume changes of hippocampal and amygdala subfields in patients with mild cognitive impairment and Alzheimer's disease.,Automated segmentation of hippocampal and amygdala subfields could improve classification accuracy of Mild Cognitive Impairments (MCI) and Alzheimer's Disease (AD) individuals.,2023,Alzheimer’s disease; Amygdala; Automated segmentation method; Hippocampus; Mild cognitive impairment,Humans; Alzheimer Disease; Hippocampus; Cognitive Dysfunction; Temporal Lobe; Magnetic Resonance Imaging; Amygdala,"Qu, H; Ge, H; Wang, L; Wang, W; Hu, C"
Differences in white matter hyperintensities in socioeconomically deprived groups: results of the population-based LIFE Adult Study.,Previous studies have shown that socioeconomically deprived groups exhibit higher lesion load of the white matter (WM) in aging. The aim of this study was to (i) investigate to what extent education and income may contribute to differences in white matter hyperintensities (WMHs) and (ii) identify risk profiles related to a higher prevalence of age-associated WMH.,2023,aging; brain; education; income; lifestyle; risk factors; socioeconomic status; white matter hyperintensities,,"Rodriguez, FS; Lampe, L; Gaebler, M; Beyer, F; Baber, R; Burkhardt, R; Schroeter, ML; Engel, C; Löffler, M; Thiery, J; Villringer, A; Riedel-Heller, SG; Witte, AV"
Mediation of Reduced Hippocampal Volume by Cerebral Amyloid Angiopathy in Pathologically Confirmed Patients with Alzheimer's Disease.,Hippocampal atrophy in cerebral amyloid angiopathy (CAA) has been reported to be similar to that in Alzheimer's disease (AD).,2023,Alzheimer’s disease; cerebral amyloid angiopathy; hippocampus; trophy,Humans; Alzheimer Disease; Cerebral Amyloid Angiopathy; Apolipoproteins E; Apolipoprotein E4; Hippocampus,"Nagaraja, N; Wang, WE; Duara, R; DeKosky, ST; Vaillancourt, D"
Attention-Guided Autoencoder for Automated Progression Prediction of Subjective Cognitive Decline With Structural MRI.,"Subjective cognitive decline (SCD) is the preclinical stage of Alzheimer's disease (AD) which happens even earlier than mild cognitive impairment (MCI). Progressive SCD will convert to MCI with the potential of further evolving to AD. Therefore, early identification of progressive SCD with neuroimaging techniques (e.g., structural MRI) is of great clinical value for early intervention of AD. However, existing MRI-based machine/deep learning methods usually suffer the small-sample-size problem and lack interpretability. To this end, we propose an interpretable autoencoder model with domain transfer learning (IADT) for progression prediction of SCD. Firstly, the proposed model can leverage MRIs from both the target domain (i.e., SCD) and auxiliary domains (e.g., AD and NC) for progressive SCD identification. Besides, it can automatically locate the disease-related brain regions of interest (defined in brain atlases) through an attention mechanism, which shows good interpretability. In addition, the IADT model is straightforward to train and test with only 5  ∼ 10 seconds on CPUs and is suitable for medical tasks with small datasets. Extensive experiments on the publicly available ADNI dataset and a private CLAS dataset have demonstrated the effectiveness of the proposed method.",2023,,Humans; Magnetic Resonance Imaging; Neuroimaging; Machine Learning; Brain; Cognitive Dysfunction; Alzheimer Disease; Disease Progression,"Guan, H; Yue, L; Yap, PT; Xiao, S; Bozoki, A; Liu, M"
Risk Prediction of Alzheimer's Disease Conversion in Mild Cognitive Impaired Population Based on Brain Age Estimation.,"Alzheimer's disease (AD) is one of the most common neurodegenerative diseases in the world. To reduce the incidence of AD, it's essential to quantify the AD conversion risk of mild cognitive impaired (MCI) individuals. Here, we propose an AD conversion risk estimation system (CRES), which contains an automated MRI feature extractor, brain age estimation (BAE) module, and AD conversion risk estimation module. The CRES is trained on 634 normal controls (NC) from the public IXI and OASIS cohorts, then it is evaluated on 462 subjects (106 NC, 102 stable MCI (sMCI), 124 progressive MCI (pMCI) and 130 AD) from the ADNI dataset. Experimental results show that the MRI derived age gap (AG, chronological age subtracted from the estimated brain age) significantly distinguish NC, sMCI, pMCI and AD groups with p -value =0.000017 . Considering AG as the primary factor, incorporating gender and Minimum Mental State Examination (MMSE) for more robust Cox multi-variate hazard analysis, we concluded that each additional year in AG is associated with 4.57% greater AD conversion risk for the MCI group. Furthermore, a nomogram was drawn to describe MCI conversion risk at the individual level in the next 1 year, 3 years, 5 years and even 8 years from baseline. This work demonstrates that CRES can estimate AG based on MRI data, evaluate AD conversion risk of the MCI subjects, and identify the individuals with high AD conversion risk, which is valuable for effective intervention and diagnosis within an early period.",2023,,Humans; Alzheimer Disease; Cognitive Dysfunction; Magnetic Resonance Imaging; Brain; Cognition; Disease Progression,"Liu, W; Dong, Q; Sun, S; Shen, J; Qian, K; Hu, B"
Real-Time Growth Kinetics Analysis of Macromolecular Assemblies in Cells with Single Molecule Resolution.,"Single molecule fluorescence microscopy has the unique advantage to provide real-time information on the spatiotemporal assembly of individual protein complexes in cellular membranes. This includes the assembly of proteins into oligomer species of numerous copy numbers. However, there is a need for improved tracing analysis of the real-time growth kinetics of these assemblies in cells with single molecule resolution. Here, we present an automated analysis software to accurately measure the real-time kinetics of assembly of individual high-order oligomer complexes. Our software comes with a simple Graphical User Interface (GUI), is available as a source code and an executable, and can analyze a full data set of several hundred to thousand molecules in less than 2 minutes. Importantly, this software is suitable for the analysis of intracellular protein oligomers, whose stoichiometry is usually more difficult to quantify due to variability in signal detection in the different areas of the cell. We validated our method with simulated ground-truth data and time-lapse images of diffraction-limited oligomeric assemblies of BAX and BAK proteins on mitochondria of cells undergoing apoptosis. Our approach provides the broad community of biologists with a fast, user-friendly tool to trace the compositional evolution of macromolecular assemblies, and potentially model their growth for a deeper understanding of the structural and biophysical mechanisms underlying their functions.",2023,,Kinetics; Software,"Danial, JSH; Jenner, A; Garcia-Saez, AJ; Cosentino, K"
"A WeChat-based Intervention, Wellness Enhancement for Caregivers (WECARE), for Chinese American Dementia Caregivers: Pilot Assessment of Feasibility, Acceptability, and Preliminary Efficacy.","Chinese American family caregivers of persons with dementia experience high rates of psychosocial distress and adverse health outcomes. Due to their immigrant and minority status, they face substantial obstacles to care and support, including stigma and misperception of dementia, limited knowledge and use of welfare and services, and poor social support. Few interventions have been developed or tested for this vulnerable population.",2023,Alzheimer disease; Chinese; Chinese American; WeChat; caregiver; caregiving; cultural; dementia; ethnic; family care; informal care; mHealth; mHealth intervention; minority; mobile health; social media; spousal care,,"Hong, YA; Shen, K; Han, HR; Ta Park, V; Bagchi, P; Lu, HK; Chen, H; Wang, JH"
Reproducible Abnormalities and Diagnostic Generalizability of White Matter in Alzheimer's Disease.,"Alzheimer's disease (AD) is associated with the impairment of white matter (WM) tracts. The current study aimed to verify the utility of WM as the neuroimaging marker of AD with multisite diffusion tensor imaging datasets [321 patients with AD, 265 patients with mild cognitive impairment (MCI), 279 normal controls (NC)], a unified pipeline, and independent site cross-validation. Automated fiber quantification was used to extract diffusion profiles along tracts. Random-effects meta-analyses showed a reproducible degeneration pattern in which fractional anisotropy significantly decreased in the AD and MCI groups compared with NC. Machine learning models using tract-based features showed good generalizability among independent site cross-validation. The diffusion metrics of the altered regions and the AD probability predicted by the models were highly correlated with cognitive ability in the AD and MCI groups. We highlighted the reproducibility and generalizability of the degeneration pattern of WM tracts in AD.",2023,Alzheimer’s disease; Cross-validation; Diffusion tensor imaging; White matter tracts,Humans; White Matter; Diffusion Tensor Imaging; Alzheimer Disease; Reproducibility of Results; Cognition; Cognitive Dysfunction; Brain,"Qu, Y; Wang, P; Yao, H; Wang, D; Song, C; Yang, H; Zhang, Z; Chen, P; Kang, X; Du, K; Fan, L; Zhou, B; Han, T; Yu, C; Zhang, X; Zuo, N; Jiang, T; Zhou, Y; Liu, B; Han, Y; Lu, J; Liu, Y"
