title,abstract,publication_year,keywords,mesh_terms,authors
Clinically feasible automated MRI volumetry of the brain as a prognostic marker in subjective and mild cognitive impairment.,"The number of patients suffering from cognitive decline and dementia increases, and new possible treatments are being developed. Thus, the need for time efficient and cost-effective methods to facilitate an early diagnosis and prediction of future cognitive decline in patients with early cognitive symptoms is becoming increasingly important. The aim of this study was to evaluate whether an MRI based software, NeuroQuant® (NQ), producing volumetry of the hippocampus and whole brain volume (WBV) could predict: (1) conversion from subjective cognitive decline (SCD) at baseline to mild cognitive impairment (MCI) or dementia at follow-up, and from MCI at baseline to dementia at follow-up and (2) progression of cognitive and functional decline defined as an annual increase in the Clinical Dementia Rating Scale Sum of Boxes (CDR-SB) score.",2024,Alzheimer’s disease; Clinical Dementia Rating Scale; automated volumetry NeuroQuant®; dementia; disease progression; magnetic resonance imaging; mild cognitive impairment; subjective cognitive decline,,"Amland, R; Selbæk, G; Brækhus, A; Edwin, TH; Engedal, K; Knapskog, AB; Olsrud, ER; Persson, K"
Poststroke cognitive outcome is better accounted for by white matter abnormalities automated segmentation than visual analysis.,"The association between white matter abnormalities (WMA) and cognitive decline previously reported in poststroke patients has been mainly documented using visual scales. However, automated segmentation of WMA provides a precise determination of the volume of WMA. Nonetheless, it is rarely used in the stroke population and its potential advantage over visual scales is still unsettled. The objective of this study was to examine whether automated segmentation of WMA provides a better account than the visual Fazekas and Wahlund scales of the decline in executive functions and processing speed in stroke patients.",2024,Control functions; Dementia; Executive functions; Hemorrhage; Infarct; MRI; Mild cognitive impairment; Stroke; WMH,,"Lawson, B; Martin, J; Aarabi, A; Ouin, E; Tasseel-Ponche, S; Barbay, M; Andriuta, D; Roussel, M; Godefroy, O"
Extraction of sleep information from clinical notes of Alzheimer's disease patients using natural language processing.,"Alzheimer's disease (AD) is the most common form of dementia in the United States. Sleep is one of the lifestyle-related factors that has been shown critical for optimal cognitive function in old age. However, there is a lack of research studying the association between sleep and AD incidence. A major bottleneck for conducting such research is that the traditional way to acquire sleep information is time-consuming, inefficient, non-scalable, and limited to patients' subjective experience. We aim to automate the extraction of specific sleep-related patterns, such as snoring, napping, poor sleep quality, daytime sleepiness, night wakings, other sleep problems, and sleep duration, from clinical notes of AD patients. These sleep patterns are hypothesized to play a role in the incidence of AD, providing insight into the relationship between sleep and AD onset and progression.",2024,Alzheimer’s disease; clinical notes; electronic health records; information extraction; natural language processing; sleep,,"Sivarajkumar, S; Tam, TYC; Mohammad, HA; Viggiano, S; Oniani, D; Visweswaran, S; Wang, Y"
The Case of the Cookie Jar: Differences in Typical Language Use in Dementia.,Findings from language sample analyses can provide efficient and effective indicators of cognitive impairment in older adults.,2024,Alzheimer’s disease; language; mild cognitive impairment; speech,,"Fromm, D; Dalton, SG; Brick, A; Olaiya, G; Hill, S; Greenhouse, J; MacWhinney, B"
Evaluation of core Biomarkers of Alzheimer's disease in saliva and plasma measured by chemiluminescent enzyme immunoassays on a fully automated platform.,"Cerebrospinal fluid (CSF) core biomarkers of Alzheimer's disease (AD), including amyloid peptide beta-42 (Aβ42), Aβ42/40 ratio, and phosphorylated tau (pTau), are precious tools for supporting AD diagnosis. However, their use in clinical practice is limited due to the invasiveness of CSF collection. Thus, there is intensive research to find alternative, noninvasive, and widely accessible biological matrices to measure AD core biomarkers. In this study, we measured AD core biomarkers in saliva and plasma by a fully automated platform. We enrolled all consecutive patients with cognitive decline. For each patient, we measured Aβ42, Aβ40, and pTau levels in CSF, saliva, and plasma by Lumipulse G1200 (Fujirebio). We included forty-two patients, of whom 27 had AD. Levels of all biomarkers significantly differed in the three biofluids, with saliva having the lowest and CSF the highest levels of Aβ42, Aβ40, and pTau. A positive correlation of pTau, Aβ42/40 ratio, and pTau/Aβ42 ratio levels in CSF and plasma was detected, while no correlation between any biomarker in CSF and saliva was found. Our findings suggest that plasma but not saliva could represent a surrogate biofluid for measuring core AD biomarkers. Specifically, plasma Aβ42/40 ratio, pTau/Aβ42 ratio, and pTau could serve as surrogates of the corresponding CSF biomarkers.",2024,AD; Beta-amyloid; Biomarker; Fujirebio; Plasma; Saliva; Tau,"Humans; Alzheimer Disease; Saliva; Biomarkers; Female; Male; Aged; Amyloid beta-Peptides; tau Proteins; Middle Aged; Peptide Fragments; Luminescent Measurements; Aged, 80 and over","Agnello, L; Giglio, RV; Del Ben, F; Piccoli, T; Colletti, T; Scazzone, C; Lo Sasso, B; Ciaccio, AM; Gambino, CM; Salemi, G; Ciaccio, M"
Can white matter hyperintensities based Fazekas visual assessment scales inform about Alzheimer's disease pathology in the population?,"White matter hyperintensities (WMH) are considered hallmark features of cerebral small vessel disease and have recently been linked to Alzheimer's disease (AD) pathology. Their distinct spatial distributions, namely periventricular versus deep WMH, may differ by underlying age-related and pathobiological processes contributing to cognitive decline. We aimed to identify the spatial patterns of WMH using the 4-scale Fazekas visual assessment and explore their differential association with age, vascular health, AD imaging markers, namely amyloid and tau burden, and cognition. Because our study consisted of scans from GE and Siemens scanners with different resolutions, we also investigated inter-scanner reproducibility and combinability of WMH measurements on imaging.",2024,Alzheimer’s disease; Deep white matter hyperintensity; Fazekas score; Periventricular white matter hyperintensity; White matter hyperintensities,"Humans; Alzheimer Disease; Female; Male; Aged; White Matter; Magnetic Resonance Imaging; Aged, 80 and over; Positron-Emission Tomography; Reproducibility of Results; Middle Aged; tau Proteins; Brain","Pradeep, A; Raghavan, S; Przybelski, SA; Preboske, GM; Schwarz, CG; Lowe, VJ; Knopman, DS; Petersen, RC; Jack, CR; Graff-Radford, J; Cogswell, PM; Vemuri, P"
Assessing CT-based Volumetric Analysis via Transfer Learning with MRI and Manual Labels for Idiopathic Normal Pressure Hydrocephalus.,"Brain computed tomography (CT) is an accessible and commonly utilized technique for assessing brain structure. In cases of idiopathic normal pressure hydrocephalus (iNPH), the presence of ventriculomegaly is often neuroradiologically evaluated by visual rating and manually measuring each image. Previously, we have developed and tested a deep-learning-model that utilizes transfer learning from magnetic resonance imaging (MRI) for CT-based intracranial tissue segmentation. Accordingly, herein we aimed to enhance the segmentation of ventricular cerebrospinal fluid (VCSF) in brain CT scans and assess the performance of automated brain CT volumetrics in iNPH patient diagnostics.",2024,CNNs; CT; MRI; deep learning; hydrocephalus; volumetry,,"Srikrishna, M; Seo, W; Zettergren, A; Kern, S; Cantré, D; Gessler, F; Sotoudeh, H; Seidlitz, J; Bernstock, JD; Wahlund, LO; Westman, E; Skoog, I; Virhammar, J; Fällmar, D; Schöll, M"
Vision-based estimation of fatigue and engagement in cognitive training sessions.,"Computerized cognitive training (CCT) is a scalable, well-tolerated intervention that has promise for slowing cognitive decline. The effectiveness of CCT is often affected by a lack of effective engagement. Mental fatigue is a the primary factor for compromising effective engagement in CCT, particularly in older adults at risk for dementia. There is a need for scalable, automated measures that can constantly monitor and reliably detect mental fatigue during CCT. Here, we develop and validate a novel Recurrent Video Transformer (RVT) method for monitoring real-time mental fatigue in older adults with mild cognitive impairment using their video-recorded facial gestures during CCT. The RVT model achieved the highest balanced accuracy (79.58%) and precision (0.82) compared to the prior models for binary and multi-class classification of mental fatigue. We also validated our model by significantly relating to reaction time across CCT tasks (Waldχ",2024,Cognitive training; Computer vision; Disengagement; Facial gestures; Fatigue detection,,"Wang, Y; Turnbull, A; Xu, Y; Heffner, K; Lin, FV; Adeli, E"
An Overview of the ADReSS-M Signal Processing Grand Challenge on Multilingual Alzheimer's Dementia Recognition Through Spontaneous Speech.,"The ADReSS-M Signal Processing Grand Challenge was held at the 2023 IEEE International Conference on Acoustics, Speech and Signal Processing, ICASSP 2023. The challenge targeted difficult automatic prediction problems of great societal and medical relevance, namely, the detection of Alzheimer's Dementia (AD) and the estimation of cognitive test scoress. Participants were invited to create models for the assessment of cognitive function based on spontaneous speech data. Most of these models employed signal processing and machine learning methods. The ADReSS-M challenge was designed to assess the extent to which predictive models built based on speech in one language generalise to another language. The language data compiled and made available for ADReSS-M comprised English, for model training, and Greek, for model testing and validation. To the best of our knowledge no previous shared research task investigated acoustic features of the speech signal or linguistic characteristics in the context of multilingual AD detection. This paper describes the context of the ADReSS-M challenge, its data sets, its predictive tasks, the evaluation methodology we employed, our baseline models and results, and the top five submissions. The paper concludes with a summary discussion of the ADReSS-M results, and our critical assessment of the future outlook in this field.",2024,Alzheimer’s disease; Biomedical signal processing; human disease biomarkers; medical conditions; multilingual Alzheimer’s dementia detection; natural language processing; speech processing,,"Luz, S; Haider, F; Fromm, D; Lazarou, I; Kompatsiaris, I; Macwhinney, B"
Prolonged ventricular repolarization associated with mild cognitive impairment and white matter hyperintensities: a cross-sectional study.,"Prolonged ventricular repolarization has been associated with cardiovascular disease. We sought to investigate the association of prolonged ventricular repolarization with mild cognitive impairment (MCI) and the potential underlying neuropathological mechanisms in older adults. This cross-sectional study included 4328 dementia-free participants (age ≥ 65 years; 56.8% female) in the baseline examination of the Multidomain INterventions to delay dementia and Disability in rural China; of these, 989 undertook structural brain magnetic resonance imaging (MRI) scans. QT, QTc, JT, JTc, and QRS intervals were derived from 12-lead electrocardiograph. MCI, amnestic MCI (aMCI), and non-amnestic MCI (naMCI) were defined following the Petersen's criteria. Volumes of gray matter (GM), white matter, cerebrospinal fluid, total white matter hyperintensities (WMH), periventricular WMH (PWMH), and deep WMH (DWMH) were automatically estimated. Data were analyzed using logistic and general linear regression models. Prolonged QT, QTc, JT, and JTc intervals were significantly associated with an increased likelihood of MCI and aMCI, but not naMCI (p < 0.05). In the MRI subsample, QT, QTc, JT, and JTc intervals were significantly associated with larger total WMH and PWMH volumes (p < 0.05), but not with DWMH volume. Statistical interactions were detected, such that prolonged QT and JT intervals were significantly associated with reduced GM volume only among participants with coronary heart disease or without APOE ε4 allele (p < 0.05). Prolonged ventricular repolarization is associated with MCI and cerebral microvascular lesions in a general population of older adults. This underlies the importance of cognitive assessments and brain MRI examination among older adults with prolonged QT interval.",2024,Cross-sectional study; Electrocardiogram; Mild cognitive impairment; Prolonged ventricular repolarization; White matter hyperintensities,"Humans; Cognitive Dysfunction; Female; Male; Aged; Cross-Sectional Studies; White Matter; Magnetic Resonance Imaging; Electrocardiography; Aged, 80 and over; Gray Matter; China","Mao, M; Wei, Y; Wang, C; Han, X; Liu, R; Dong, Y; Song, L; Cong, L; Wang, Y; Du, Y; Qiu, C"
Predicting changes in brain metabolism and progression from mild cognitive impairment to dementia using multitask Deep Learning models and explainable AI.,"The prediction of Alzheimer's disease (AD) progression from its early stages is a research priority. In this context, the use of Artificial Intelligence (AI) in AD has experienced a notable surge in recent years. However, existing investigations predominantly concentrate on distinguishing clinical phenotypes through cross-sectional approaches. This study aims to investigate the potential of modeling additional dimensions of the disease, such as variations in brain metabolism assessed via [",2024,Alzheimer disease; Artificial intelligence; Automated pattern recognition; Deep learning; Machine learning; Neurodegenerative diseases; Neuroimaging; Positron-emission tomography,,"García-Gutiérrez, F; Hernández-Lorenzo, L; Cabrera-Martín, MN; Matias-Guiu, JA; Ayala, JL"
Cortex-to-caudate volume ratio as a predictor of cognitive decline in Alzheimer's disease and mild cognitive impairment.,Brain and cortical atrophy play crucial roles in supporting the clinical diagnosis of Alzheimer's disease (AD). This study hypothesized that the ratios of brain or cortical volume to subcortical gray matter structure volumes are potential imaging markers for cognitive alterations in AD dementia and amnestic mild cognitive impairment (aMCI).,2024,Cognition; Dementia; Image analysis,"Humans; Alzheimer Disease; Male; Female; Cognitive Dysfunction; Aged; Magnetic Resonance Imaging; Cerebral Cortex; Neuropsychological Tests; Aged, 80 and over; Organ Size; Follow-Up Studies; Middle Aged; Disease Progression; Atrophy","Na, S; Kim, T; Song, IU; Hong, YJ; Kim, SH"
Discrete Relationships between Spatiotemporal Gait Characteristics and Domain-Specific Neuropsychological Performance in Midlife.,"Midlife risk factors such as type 2 diabetes mellitus (T2DM) confer a significantly increased risk of cognitive impairment in later life with executive function, memory, and attention domains often affected first. Spatiotemporal gait characteristics are emerging as important integrative biomarkers of neurocognitive function and of later dementia risk. We examined 24 spatiotemporal gait parameters across five domains of gait previously linked to cognitive function on usual-pace, maximal-pace, and cognitive dual-task gait conditions in 102 middle-aged adults with (57.5 ± 8.0 years; 40% female) and without (57.0 ± 8.3 years; 62.1% female) T2DM. Neurocognitive function was measured using a neuropsychological assessment battery. T2DM was associated with significant changes in gait phases and rhythm domains at usual pace, and greater gait variability observed during maximal pace and dual tasks. In the overall cohort, both the gait pace and rhythm domains were associated with memory and executive function during usual pace. At maximal pace, gait pace parameters were associated with reaction time and delayed memory. During the cognitive dual task, associations between gait variability and both delayed memory/executive function were observed. Associations persisted following covariate adjustment and did not differ by T2DM status. Principal components analysis identified a consistent association of slower gait pace (step/stride length) and increased gait variability during maximal-pace walking with poorer memory and executive function performance. These data support the use of spatiotemporal gait as an integrative biomarker of neurocognitive function in otherwise healthy middle-aged individuals and reveal discrete associations between both differing gait tasks and gait domains with domain-specific neuropsychological performance. Employing both maximal-pace and dual-task paradigms may be important in cognitively unimpaired populations with risk factors for later cognitive decline-with the aim of identifying individuals who may benefit from potential preventative interventions.",2024,automated walkway; cognition; cognitive impairment; dementia; dual task; gait; midlife; neuropsychological; type 2 diabetes,"Humans; Female; Middle Aged; Male; Gait; Diabetes Mellitus, Type 2; Neuropsychological Tests; Executive Function; Cognition; Memory; Aged","Morrison, L; Dyer, AH; Dolphin, H; Killane, I; Bourke, NM; Widdowson, M; Woods, CP; Gibney, J; Reilly, RB; Kennelly, SP"
Diagnostic performance of plasma pTau,"Recently developed blood markers for Alzheimer's disease (AD) detection have high accuracy but usually require ultra-sensitive analytic tools not commonly available in clinical laboratories, and their performance in clinical practice is unknown.",2024,Alzheimer; Amyloid; Biomarkers; Blood; Plasma; Tau,"Humans; Amyloid beta-Peptides; Alzheimer Disease; Female; Male; Peptide Fragments; tau Proteins; Aged; Biomarkers; Middle Aged; Cognitive Dysfunction; Aged, 80 and over; ROC Curve; Phosphorylation","Arranz, J; Zhu, N; Rubio-Guerra, S; Rodríguez-Baz, Í; Ferrer, R; Carmona-Iragui, M; Barroeta, I; Illán-Gala, I; Santos-Santos, M; Fortea, J; Lleó, A; Tondo, M; Alcolea, D"
Prediction of Alzheimer's disease progression within 6 years using speech: A novel approach leveraging language models.,Identification of individuals with mild cognitive impairment (MCI) who are at risk of developing Alzheimer's disease (AD) is crucial for early intervention and selection of clinical trials.,2024,Alzheimer's disease prognosis; Framingham Heart Study; natural language processing; neuropsychological test,,"Amini, S; Hao, B; Yang, J; Karjadi, C; Kolachalama, VB; Au, R; Paschalidis, IC"
Residual-Based Multi-Stage Deep Learning Framework for Computer-Aided Alzheimer's Disease Detection.,"Alzheimer's Disease (AD) poses a significant health risk globally, particularly among the elderly population. Recent studies underscore its prevalence, with over 50% of elderly Japanese facing a lifetime risk of dementia, primarily attributed to AD. As the most prevalent form of dementia, AD gradually erodes brain cells, leading to severe neurological decline. In this scenario, it is important to develop an automatic AD-detection system, and many researchers have been working to develop an AD-detection system by taking advantage of the advancement of deep learning (DL) techniques, which have shown promising results in various domains, including medical image analysis. However, existing approaches for AD detection often suffer from limited performance due to the complexities associated with training hierarchical convolutional neural networks (CNNs). In this paper, we introduce a novel multi-stage deep neural network architecture based on residual functions to address the limitations of existing AD-detection approaches. Inspired by the success of residual networks (ResNets) in image-classification tasks, our proposed system comprises five stages, each explicitly formulated to enhance feature effectiveness while maintaining model depth. Following feature extraction, a deep learning-based feature-selection module is applied to mitigate overfitting, incorporating batch normalization, dropout and fully connected layers. Subsequently, machine learning (ML)-based classification algorithms, including Support Vector Machines (SVM), Random Forest (RF) and SoftMax, are employed for classification tasks. Comprehensive evaluations conducted on three benchmark datasets, namely ADNI1: Complete 1Yr 1.5T, MIRAID and OASIS Kaggle, demonstrate the efficacy of our proposed model. Impressively, our model achieves accuracy rates of 99.47%, 99.10% and 99.70% for ADNI1: Complete 1Yr 1.5T, MIRAID and OASIS datasets, respectively, outperforming existing systems in binary class problems. Our proposed model represents a significant advancement in the AD-analysis domain.",2024,Alzheimer’s disease; CNN; Random Forest; machine learning; residual network,,"Hassan, N; Musa Miah, AS; Shin, J"
A Simple Sandwich Electrochemical Immunosensor for Rapid Detection of the Alzheimer's Disease Biomarker Tau Protein.,"As a typical biomarker of Alzheimer's disease, rapid and specific detection of tau protein can help improve the early diagnosis and prognosis of the disease. In this study, a simple sandwich electrochemical immunosensor was developed for rapid detection of tau protein. Primary monoclonal antibodies (mAb1) against the middle domain of tau protein (amino acids 189-195) were immobilized on the gold electrode surface through a self-assembled monolayer (SAM) of 3,3'-dithiobis (sulfosuccinimidyl propionate) (DTSSP). Then the tau protein was captured through the specific adsorption between the antigen and the antibody, resulting in a change in the impedance. Secondary monoclonal antibodies (mAb2) against the N-terminal region of tau protein were used for further amplification of the binding reaction between mAb1 and tau protein. A linear correlation between the total change in impedance and the logarithm of tau concentration was found from 2 × 10",2024,Alzheimer’s disease (AD); immunosensor; impedance; sandwich; tau protein,"tau Proteins; Alzheimer Disease; Humans; Biosensing Techniques; Biomarkers; Electrochemical Techniques; Antibodies, Monoclonal; Gold; Immunoassay; Limit of Detection; Electrodes","Yang, M; Chen, Y; Sun, H; Li, D; Li, Y"
A novel insight into neurological disorders through HDAC6 protein-protein interactions.,"Due to its involvement in physiological and pathological processes, histone deacetylase 6 (HDAC6) is considered a promising pharmaceutical target for several neurological manifestations. However, the exact regulatory role of HDAC6 in the central nervous system (CNS) is still not fully understood. Hence, using a semi-automated literature screening technique, we systematically collected HDAC6-protein interactions that are experimentally validated and reported in the CNS. The resulting HDAC6 network encompassed 115 HDAC6-protein interactions divided over five subnetworks: (de)acetylation, phosphorylation, protein complexes, regulatory, and aggresome-autophagy subnetworks. In addition, 132 indirect interactions identified through HDAC6 inhibition were collected and categorized. Finally, to display the application of our HDAC6 network, we mapped transcriptomics data of Alzheimer's disease, Parkinson's disease, and Amyotrophic Lateral Sclerosis on the network and highlighted that in the case of Alzheimer's disease, alterations predominantly affect the HDAC6 phosphorylation subnetwork, whereas differential expression within the deacetylation subnetwork is observed across all three neurological disorders. In conclusion, the HDAC6 network created in the present study is a novel and valuable resource for the understanding of the HDAC6 regulatory mechanisms, thereby providing a framework for the integration and interpretation of omics data from neurological disorders and pharmacodynamic assessments.",2024,Alzheimer’s disease; Amyotrophic lateral sclerosis; Central nervous system; Histone deacetylase 6 (HDAC6); Parkinson’s disease; Protein–protein interactions,Histone Deacetylase 6; Humans; Protein Interaction Maps; Nervous System Diseases; Alzheimer Disease; Phosphorylation; Acetylation; Parkinson Disease,"Bahram Sangani, N; Koetsier, J; Mélius, J; Kutmon, M; Ehrhart, F; Evelo, CT; Curfs, LMG; Reutelingsperger, CP; Eijssen, LMT"
