title,abstract,publication_year,keywords,mesh_terms,authors
Diagnosis-Guided Deep Subspace Clustering Association Study for Pathogenetic Markers Identification of Alzheimer's Disease Based on Comparative Atlases.,"The roles of brain region activities and genotypic functions in the pathogenesis of Alzheimer's disease (AD) remain unclear. Meanwhile, current imaging genetics methods are difficult to identify potential pathogenetic markers by correlation analysis between brain network and genetic variation. To discover disease-related brain connectome from the specific brain structure and the fine-grained level, based on the Automated Anatomical Labeling (AAL) and human Brainnetome atlases, the functional brain network is first constructed for each subject. Specifically, the upper triangle elements of the functional connectivity matrix are extracted as connectivity features. The clustering coefficient and the average weighted node degree are developed to assess the significance of every brain area. Since the constructed brain network and genetic data are characterized by non-linearity, high-dimensionality, and few subjects, the deep subspace clustering algorithm is proposed to reconstruct the original data. Our multilayer neural network helps capture the non-linear manifolds, and subspace clustering learns pairwise affinities between samples. Moreover, most approaches in neuroimaging genetics are unsupervised learning, neglecting the diagnostic information related to diseases. We presented a label constraint with diagnostic status to instruct the imaging genetics correlation analysis. To this end, a diagnosis-guided deep subspace clustering association (DDSCA) method is developed to discover brain connectome and risk genetic factors by integrating genotypes with functional network phenotypes. Extensive experiments prove that DDSCA achieves superior performance to most association methods and effectively selects disease-relevant genetic markers and brain connectome at the coarse-grained and fine-grained levels.",2024,,Humans; Alzheimer Disease; Cluster Analysis; Brain; Magnetic Resonance Imaging; Connectome; Algorithms; Aged; Biomarkers; Female; Male; Atlases as Topic; Neuroimaging,"Jiao, CN; Shang, J; Li, F; Cui, X; Wang, YL; Gao, YL; Liu, JX"
Estimating Dementia Onset: AT(N) Profiles and Predictive Modeling in Mild Cognitive Impairment Patients.,Mild Cognitive Impairment (MCI) usually precedes the symptomatic phase of dementia and constitutes a window of opportunities for preventive therapies.,2024,AT(N) biomarkers; Alzheimer’s disease; Mild cognitive impairment; dementia.; disease progression modeling; predictive models,"Humans; Cognitive Dysfunction; Disease Progression; Aged; Male; Female; Dementia; Longitudinal Studies; Neuropsychological Tests; Aged, 80 and over; Neuroimaging; Cohort Studies","Platero, C; Tohka, J; Strange, B"
Machine learning models identify predictive features of patient mortality across dementia types.,Dementia care is challenging due to the divergent trajectories in disease progression and outcomes. Predictive models are needed to flag patients at risk of near-term mortality and identify factors contributing to mortality risk across different dementia types.,2024,,,"Zhang, J; Song, L; Miller, Z; Chan, KCG; Huang, KL"
Unsupervised Online Paired Associates Learning Task from the Cambridge Neuropsychological Test Automated Battery (CANTAB®) in the Brain Health Registry.,"Unsupervised online cognitive assessments have demonstrated promise as an efficient and scalable approach for evaluating cognition in aging, and Alzheimer's disease and related dementias.",2024,Brain health registry; CANTAB; Mild Cognitive Impairment; Paired Associates Learning; unsupervised cognitive assessment,Adult; Humans; Male; Female; Alzheimer Disease; Cross-Sectional Studies; Brain; Neuropsychological Tests; Registries,"Ashford, MT; Aaronson, A; Kwang, W; Eichenbaum, J; Gummadi, S; Jin, C; Cashdollar, N; Thorp, E; Wragg, E; Zavitz, KH; Cormack, F; Banh, T; Neuhaus, JM; Ulbricht, A; Camacho, MR; Fockler, J; Flenniken, D; Truran, D; Mackin, RS; Weiner, MW; Nosheny, RL"
Using blood transcriptome analysis for Alzheimer's disease diagnosis and patient stratification.,Blood protein biomarkers demonstrate potential for Alzheimer's disease (AD) diagnosis. Limited studies examine the molecular changes in AD blood cells.,2024,Alzheimer's disease; blood; co‐expression; deconvolution; diagnosis; neutrophil; stratification; transcriptome,Humans; Alzheimer Disease; Transcriptome; Gene Expression Profiling; Gene Regulatory Networks; Biomarkers,"Zhong, H; Zhou, X; Uhm, H; Jiang, Y; Cao, H; Chen, Y; Mak, TTW; Lo, RMN; Wong, BWY; Cheng, EYL; Mok, KY; Chan, ALT; Kwok, TCY; Mok, VCT; Ip, FCF; Hardy, J; Fu, AKY; Ip, NY"
"Brief webcam test of hand movements predicts episodic memory, executive function, and working memory in a community sample of cognitively asymptomatic older adults.",Low-cost simple tests for preclinical Alzheimer's disease are a research priority. We evaluated whether remote unsupervised webcam recordings of finger-tapping were associated with cognitive performance in older adults.,2024,RapidMotionTrack; TAS Test; biomarkers; dementia; motor‐cognitive; preclinical,,"Li, R; Wang, X; Lawler, K; Garg, S; St George, RJ; Bindoff, AD; Bartlett, L; Roccati, E; King, AE; Vickers, JC; Bai, Q; Alty, J"
Multisensory Calibration: A Variety of Slow and Fast Brain Processes Throughout the Lifespan.,"From before we are born, throughout development, adulthood, and aging, we are immersed in a multisensory world. At each of these stages, our sensory cues are constantly changing, due to body, brain, and environmental changes. While integration of information from our different sensory cues improves precision, this only improves accuracy if the underlying cues are unbiased. Thus, multisensory calibration is a vital and ongoing process. To meet this grand challenge, our brains have evolved a variety of mechanisms. First, in response to a systematic discrepancy between sensory cues (without external feedback) the cues calibrate one another (unsupervised calibration). Second, multisensory function is calibrated to external feedback (supervised calibration). These two mechanisms superimpose. While the former likely reflects a lower level mechanism, the latter likely reflects a higher level cognitive mechanism. Indeed, neural correlates of supervised multisensory calibration in monkeys were found in higher level multisensory cortical area VIP, but not in the relatively lower level multisensory area MSTd. In addition, even without a cue discrepancy (e.g., when experiencing stimuli from different sensory cues in series) the brain monitors supra-modal statistics of events in the environment and adapts perception cross-modally. This too comprises a variety of mechanisms, including confirmation bias to prior choices, and lower level cross-sensory adaptation. Further research into the neuronal underpinnings of the broad and diverse functions of multisensory calibration, with improved synthesis of theories is needed to attain a more comprehensive understanding of multisensory brain function.",2024,Accurate; Adaptation; Perception; Recalibration; Self-motion; Serial dependence; Supervised; Unsupervised; Vestibular; Visual,Humans; Longevity; Calibration; Brain; Frontotemporal Dementia,"Zaidel, A"
Dementia Prediction in Older Adults Using Sex-Specific Health Trajectory Clustering.,"With increasing number of people living with dementia, the problem of late diagnosis significantly impacts a person's quality of life while early signs of dementia may provide useful insights to facilitate better treatment plans. With time, this progressive neurodegenerative syndrome could progress from mild cognitive impairment to dementia. A pattern of health conditions can be characterized in unsupervised manner to help predict this progress. As a significant extension to our previous work with streaming clustering model, we consider additional information for predicting dementia onset. With empirical observations, we discover the importance of examining sex and age to predict dementia onset. To this end, we propose a sex-specific model with age-constraint for predicting dementia onset and validate the effectiveness of our models using data from Mayo Clinic Study of Aging (MCSA). The proposed sex-specific models for older adult populations (>=65 years of age) outperformed the previous models with F-score of 77% and 78% for male-specific and female-specific models, respectively. Our experiments of sex-specific temporal clustering of features in older adults demonstrate the potential of more personalized models for early alerts of dementia.",2024,Clustering; dementia; mild cognitive impairment; prediction,Humans; Female; Male; Aged; Quality of Life; Aging; Cluster Analysis; Cognitive Dysfunction; Dementia,"Ibrahim, OA; Garg, M; Fu, S; Vassilaki, M; Petersen, RC; St Sauver, J; Sohn, S"
Mild cognitive impairment prediction and cognitive score regression in the elderly using EEG topological data analysis and machine learning with awareness assessed in affective reminiscent paradigm.,"The main objective of this study is to evaluate working memory and determine EEG biomarkers that can assist in the field of health neuroscience. Our ultimate goal is to utilize this approach to predict the early signs of mild cognitive impairment (MCI) in healthy elderly individuals, which could potentially lead to dementia. The advancements in health neuroscience research have revealed that affective reminiscence stimulation is an effective method for developing EEG-based neuro-biomarkers that can detect the signs of MCI.",2023,EEG; biomarker; machine learning (ML); mild cognitive impairment (MCI); prevention; topological data analysis (TDA),,"Rutkowski, TM; Komendziński, T; Otake-Matsuura, M"
Using Generative Artificial Intelligence to Classify Primary Progressive Aphasia from Connected Speech.,"Neurodegenerative dementia syndromes, such as Primary Progressive Aphasias (PPA), have traditionally been diagnosed based in part on verbal and nonverbal cognitive profiles. Debate continues about whether PPA is best subdivided into three variants and also regarding the most distinctive linguistic features for classifying PPA variants. In this study, we harnessed the capabilities of artificial intelligence (AI) and natural language processing (NLP) to first perform unsupervised classification of concise, connected speech samples from 78 PPA patients. Large Language Models discerned three distinct PPA clusters, with 88.5% agreement with independent clinical diagnoses. Patterns of cortical atrophy of three data-driven clusters corresponded to the localization in the clinical diagnostic criteria. We then used NLP to identify linguistic features that best dissociate the three PPA variants. Seventeen features emerged as most valuable for this purpose, including the observation that separating verbs into high and low-frequency types significantly improves classification accuracy. Using these linguistic features derived from the analysis of brief connected speech samples, we developed a classifier that achieved 97.9% accuracy in predicting PPA subtypes and healthy controls. Our findings provide pivotal insights for refining early-stage dementia diagnosis, deepening our understanding of the characteristics of these neurodegenerative phenotypes and the neurobiology of language processing, and enhancing diagnostic evaluation accuracy.",2023,,,"Rezaii, N; Quimby, M; Wong, B; Hochberg, D; Brickhouse, M; Touroutoglou, A; Dickerson, BC; Wolff, P"
Computerized cognitive training for memory functions in mild cognitive impairment or dementia: a systematic review and meta-analysis.,"Dementia is a common medical condition in the ageing population, and cognitive intervention is a non-pharmacologic strategy to improve cognitive functions. This meta-analysis evaluated the benefits of computerized cognitive training (CCT) on memory functions in individuals with MCI or dementia. The study was registered prospectively with PROSPERO under CRD42022363715 and received no funding. The search was conducted on MEDLINE, Embase, and PsycINFO on Sept 19, 2022, and Google Scholar on May 9, 2023, to identify randomized controlled trials that examined the effects of CCT on memory outcomes in individuals with MCI or dementia. Mean differences and standard deviations of neuropsychological assessment scores were extracted to derive standardized mean differences. Our search identified 10,678 studies, of which 35 studies were included. Among 1489 participants with MCI, CCT showed improvements in verbal memory (SMD (95%CI) = 0.55 (0.35-0.74)), visual memory (0.36 (0.12-0.60)), and working memory (0.37 (0.10-0.64)). Supervised CCT showed improvements in verbal memory (0.72 (0.45-0.98)), visual memory (0.51 (0.22-0.79)), and working memory (0.33 (0.01-0.66)). Unsupervised CCT showed improvement in verbal memory (0.21 (0.04-0.38)) only. Among 371 participants with dementia, CCT showed improvement in verbal memory (0.64 (0.02-1.27)) only. Inconsistency due to heterogeneity (as indicated by I",2024,,,"Chan, ATC; Ip, RTF; Tran, JYS; Chan, JYC; Tsoi, KKF"
Enabling Lipidomic Biomarker Studies for Protected Populations by Combining Noninvasive Fingerprint Sampling with MS Analysis and Machine Learning.,"Triacylglycerols and wax esters are two lipid classes that have been linked to diseases, including autism, Alzheimer's disease, dementia, cardiovascular disease, dry eye disease, and diabetes, and thus are molecules worthy of biomarker exploration studies. Since triacylglycerols and wax esters make up the majority of skin-surface lipid secretions, a viable sampling method for these potential biomarkers would be that of groomed latent fingerprints. Currently, however, blood-based sampling protocols predominate in the field. The invasiveness of a blood draw limits its utility to protected populations, including children and the elderly. Herein we describe a noninvasive means for sample collection (from fingerprints) paired with fast MS data-acquisition (MassIVE data set MSV000092742) and efficient data analysis via machine learning. Using both supervised and unsupervised classification, we demonstrate the usefulness of this method in determining whether a variable of interest imparts measurable change within the lipidomic data set. As a proof-of-concept, we show that the method is capable of distinguishing between the fingerprints of different individuals as well as between anatomical sebum collection regions. This noninvasive, high-throughput approach enables future lipidomic biomarker researchers to more easily include underrepresented, protected populations, such as children and the elderly, thus moving the field closer to definitive disease diagnoses that apply to all.",2024,biomarkers; fingerprints; lipidomics; lipids; machine learning; mass spectrometry; noninvasive sampling,,"Isom, M; Go, EP; Desaire, H"
Analyzing risk factors for post-acute recovery in older adults with Alzheimer's disease and related dementia: A new semi-parametric model for large-scale medicare claims.,"Nearly 300,000 older adults experience a hip fracture every year, the majority of which occur following a fall. Unfortunately, recovery after fall-related trauma such as hip fracture is poor, where older adults diagnosed with Alzheimer's disease and related dementia (ADRD) spend a particularly long time in hospitals or rehabilitation facilities during the post-operative recuperation period. Because older adults value functional recovery and spending time at home versus facilities as key outcomes after hospitalization, identifying factors that influence days spent at home after hospitalization is imperative. While several individual-level factors have been identified, the characteristics of the treating hospital have recently been identified as contributors. However, few methodological rigorous approaches are available to help overcome potential sources of bias such as hospital-level unmeasured confounders, informative hospital size, and loss to follow-up due to death. This article develops a useful tool equipped with unsupervised learning to simultaneously handle statistical complexities that are often encountered in health services research, especially when using large administrative claims databases. The proposed estimator has a closed form, thus only requiring light computation load in a large-scale study. We further develop its asymptotic properties with stabilized inference assisted by unsupervised clustering. Extensive simulation studies demonstrate superiority of the proposed estimator compared to existing estimators.",2024,dementia; post-discharge outcome; profile least square; propensity score weighting; unsupervised learning,Humans; Aged; United States; Alzheimer Disease; Medicare; Hospitalization; Risk Factors; Physical Therapy Modalities; Retrospective Studies,"Shen, B; Ren, H; Shardell, M; Falvey, J; Chen, C"
Predicting Dementia Risk for Elderly Community Dwellers in Primary Care Services Using Subgroup-specific Prediction Models.,"Early detection of individuals with a high risk of dementia is crucial for prompt intervention and clinical care. This study aims to identify high-risk groups for developing dementia by predicting the outcome of the Mini-Mental State Examination (MMSE), using historical data collected from community-based primary care services. To mitigate the effect of inter-individual variability and enhance the accuracy of the prediction, we implemented a multi-stage method powered by supervised and unsupervised machine learning methods. Firstly, we preprocessed the original data by imputing missing values and using a wrapper-based feature selection algorithm to pick significant features, resulting in ten variables out of 567 being selected for further modeling. Secondly, we optimized hierarchical clustering to partition the unlabeled data into groups by their similarities, and then applied supervised machine learning models to build subgroup-specific prediction models for the identified groups. The results demonstrate that the proposed subgroup-specific prediction models generated from the multi-stage method achieved satisfactory performance in predicting the outcome classes of dementia risk. This study highlights the potential of incorporating unsupervised and supervised learning models to predict high-risk cases of dementia early and facilitate better clinical decision-making.",2023,,Humans; Aged; Supervised Machine Learning; Algorithms; Dementia; Primary Health Care,"Hang Kwok, SW; Sipka, C; Matthews, A; Lara, CP; Wang, G; Choi, KS"
Identification of high likelihood of dementia in population-based surveys using unsupervised clustering: a longitudinal analysis.,Dementia is defined as a cognitive decline that affects functional status. Longitudinal ageing surveys often lack a clinical diagnosis of dementia though measure cognition and daily function over time. We used unsupervised machine learning and longitudinal data to identify transition to probable dementia.,2023,Dementia; Identification; Longitudinal analysis; Machine Learning; Multistate models; Population-based surveys; Unsupervised clustering,Humans; Male; Female; Middle Aged; Aged; Longitudinal Studies; Aging; Cognitive Dysfunction; Cognition; Dementia,"Gharbi-Meliani, A; Husson, F; Vandendriessche, H; Bayen, E; Yaffe, K; Bachoud-Lévi, AC; Cleret de Langavant, L"
Differential responses of primary neuron-secreted MCP-1 and IL-9 to type 2 diabetes and Alzheimer's disease-associated metabolites.,"Type 2 diabetes (T2D) is implicated as a risk factor for Alzheimer's disease (AD), the most common form of dementia. In this work, we investigated neuroinflammatory responses of primary neurons to potentially circulating, blood-brain barrier (BBB) permeable metabolites associated with AD, T2D, or both. We identified nine metabolites associated with protective or detrimental properties of AD and T2D in literature (lauric acid, asparagine, fructose, arachidonic acid, aminoadipic acid, sorbitol, retinol, tryptophan, niacinamide) and stimulated primary mouse neuron cultures with each metabolite before quantifying cytokine secretion via Luminex. We employed unsupervised clustering, inferential statistics, and partial least squares discriminant analysis to identify relationships between cytokine concentration and disease-associations of metabolites. We identified MCP-1, a cytokine associated with monocyte recruitment, as differentially abundant between neurons stimulated by metabolites associated with protective and detrimental properties of AD and T2D. We also identified IL-9, a cytokine that promotes mast cell growth, to be differentially associated with T2D. Indeed, cytokines, such as MCP-1 and IL-9, released from neurons in response to BBB-permeable metabolites associated with T2D may contribute to AD development by downstream effects of neuroinflammation.",2023,,,"Ball, BK; Kuhn, MK; Fleeman, RM; Proctor, EA; Brubaker, DK"
Automatic segmentation of white matter hyperintensities in T2-FLAIR with AQUA: A comparative validation study against conventional methods.,"White matter hyperintensities (WMHs) are lesions in the white matter of the brain that are associated with cognitive decline and an increased risk of dementia. The manual segmentation of WMHs is highly time-consuming and prone to intra- and inter-variability. Therefore, automatic segmentation approaches are gaining attention as a more efficient and objective means to detect and monitor WMHs. In this study, we propose AQUA, a deep learning model designed for fully automatic segmentation of WMHs from T2-FLAIR scans, which improves upon our previous study for small lesion detection and incorporating a multicenter approach. AQUA implements a two-dimensional U-Net architecture and uses patch-based training. Additionally, the network was modified to include Bottleneck Attention Module on each convolutional block of both the encoder and decoder to enhance performance for small-sized WMH. We evaluated the performance and robustness of AQUA by comparing it with five well-known supervised and unsupervised methods for automatic segmentation of WMHs (LGA, LPA, SLS, UBO, and BIANCA). To accomplish this, we tested these six methods on the MICCAI 2017 WMH Segmentation Challenge dataset, which contains MRI images from 170 elderly participants with WMHs of presumed vascular origin, and assessed their robustness across multiple sites and scanner types. The results showed that AQUA achieved superior performance in terms of spatial (Dice = 0.72) and volumetric (logAVD = 0.10) agreement with the manual segmentation compared to the other methods. While the recall and F1-score were moderate at 0.49 and 0.59, respectively, they improved to 0.75 and 0.82 when excluding small lesions (≤ 6 voxels). Remarkably, despite being trained on a different dataset with different ethnic backgrounds, lesion loads, and scanners, AQUA's results were comparable to the top 10 ranked methods of the MICCAI challenge. The findings suggest that AQUA is effective and practical for automatic segmentation of WMHs from T2-FLAIR scans, which could help identify individuals at risk of cognitive decline and dementia and allow for early intervention and management.",2023,Automatic segmentation; Comparative study; T2-FLAIR; U-Net; White matter hyperintensities,Humans; Aged; White Matter; Magnetic Resonance Imaging; Brain; Mental Recall; Dementia,"Lee, S; Rieu, Z; Kim, RE; Lee, M; Yen, K; Yong, J; Kim, D"
Joint learning framework of cross-modal synthesis and diagnosis for Alzheimer's disease by mining underlying shared modality information.,"Alzheimer's disease (AD) is one of the most common neurodegenerative disorders presenting irreversible progression of cognitive impairment. How to identify AD as early as possible is critical for intervention with potential preventive measures. Among various neuroimaging modalities used to diagnose AD, functional positron emission tomography (PET) has higher sensitivity than structural magnetic resonance imaging (MRI), but it is also costlier and often not available in many hospitals. How to leverage massive unpaired unlabeled PET to improve the diagnosis performance of AD from MRI becomes rather important. To address this challenge, this paper proposes a novel joint learning framework of unsupervised cross-modal synthesis and AD diagnosis by mining underlying shared modality information, improving the AD diagnosis from MRI while synthesizing more discriminative PET images. We mine underlying shared modality information in two aspects: diversifying modality information through the cross-modal synthesis network and locating critical diagnosis-related patterns through the AD diagnosis network. First, to diversify the modality information, we propose a novel unsupervised cross-modal synthesis network, which implements the inter-conversion between 3D PET and MRI in a single model modulated by the AdaIN module. Second, to locate shared critical diagnosis-related patterns, we propose an interpretable diagnosis network based on fully 2D convolutions, which takes either 3D synthesized PET or original MRI as input. Extensive experimental results on the ADNI dataset show that our framework can synthesize more realistic images, outperform the state-of-the-art AD diagnosis methods, and have better generalization on external AIBL and NACC datasets.",2024,Alzheimer’s disease (AD) diagnosis; Cross-modal synthesis; Joint learning; Magnetic resonance imaging (MRI); Positron emission tomography (PET),Humans; Alzheimer Disease; Neuroimaging; Positron-Emission Tomography; Magnetic Resonance Imaging; Learning; Cognitive Dysfunction,"Wang, C; Piao, S; Huang, Z; Gao, Q; Zhang, J; Li, Y; Shan, H"
