title,abstract,publication_year,keywords,mesh_terms,authors
Unsupervised contrastive graph learning for resting-state functional MRI analysis and brain disorder detection.,"Resting-state functional magnetic resonance imaging (rs-fMRI) helps characterize regional interactions that occur in the human brain at a resting state. Existing research often attempts to explore fMRI biomarkers that best predict brain disease progression using machine/deep learning techniques. Previous fMRI studies have shown that learning-based methods usually require a large amount of labeled training data, limiting their utility in clinical practice where annotating data is often time-consuming and labor-intensive. To this end, we propose an unsupervised contrastive graph learning (UCGL) framework for fMRI-based brain disease analysis, in which a pretext model is designed to generate informative fMRI representations using unlabeled training data, followed by model fine-tuning to perform downstream disease identification tasks. Specifically, in the pretext model, we first design a bi-level fMRI augmentation strategy to increase the sample size by augmenting blood-oxygen-level-dependent (BOLD) signals, and then employ two parallel graph convolutional networks for fMRI feature extraction in an unsupervised contrastive learning manner. This pretext model can be optimized on large-scale fMRI datasets, without requiring labeled training data. This model is further fine-tuned on to-be-analyzed fMRI data for downstream disease detection in a task-oriented learning manner. We evaluate the proposed method on three rs-fMRI datasets for cross-site and cross-dataset learning tasks. Experimental results suggest that the UCGL outperforms several state-of-the-art approaches in automated diagnosis of three brain diseases (i.e., major depressive disorder, autism spectrum disorder, and Alzheimer's disease) with rs-fMRI data.",2023,brain disorder; data augmentation; fine-tuning; functional MRI; small-sample-size,"Humans; Depressive Disorder, Major; Autism Spectrum Disorder; Rest; Brain; Magnetic Resonance Imaging; Alzheimer Disease","Wang, X; Chu, Y; Wang, Q; Cao, L; Qiao, L; Zhang, L; Liu, M"
"Performance of plasma Aβ42/40, measured using a fully automated immunoassay, across a broad patient population in identifying amyloid status.","Plasma biomarkers have emerged as promising screening tools for Alzheimer's disease (AD) because of their potential to detect amyloid β (Aβ) accumulation in the brain. One such candidate is the plasma Aβ42/40 ratio (Aβ42/40). Unlike previous research that used traditional immunoassay, recent studies that measured plasma Aβ42/40 using fully automated platforms reported promising results. However, its utility should be confirmed using a broader patient population, focusing on the potential for early detection.",2023,Alzheimer’s disease; Amyloid positron emission tomography; Amyloid β; Centiloid; Plasma Aβ42/40,Humans; Amyloid beta-Peptides; Amyloidogenic Proteins; Immunoassay; Positron-Emission Tomography; Alzheimer Disease,"Bun, S; Ito, D; Tezuka, T; Kubota, M; Ueda, R; Takahata, K; Moriguchi, S; Kurose, S; Momota, Y; Suzuki, N; Morimoto, A; Hoshino, Y; Seki, M; Mimura, Y; Shikimoto, R; Yamamoto, Y; Hoshino, T; Sato, Y; Tabuchi, H; Mimura, M"
"Patient portal interventions: a scoping review of functionality, automation used, and therapeutic elements of patient portal interventions.","We sought to understand the objectives, targeted populations, therapeutic elements, and delivery characteristics of patient portal interventions.",2023,dementia; intervention; patient portal; scoping review,,"Gleason, KT; Powell, DS; Wec, A; Zou, X; Gamper, MJ; Peereboom, D; Wolff, JL"
Increased Resolution of Structural MRI at 3T Improves Estimation of Regional Cortical Degeneration in Individual Dementia Patients Using Surface Thickness Maps.,Objective measurement of regional cortical atrophy in individual patients would be a highly desirable adjunct for diagnosis of degenerative dementias.,2023,Alzheimer’s disease; MPRAGE; atrophy; cortical thickness; degeneration; dementia; dementia diagnosis,Humans; Brain; Alzheimer Disease; Reproducibility of Results; Magnetic Resonance Imaging; Atrophy,"Fazlollahi, A; Lee, S; Coleman, F; McCann, E; Cloos, MA; Bourgeat, P; Nestor, PJ"
Blood-Brain Barrier Disruption and Perivascular Spaces in Small Vessel Disease and Neurodegenerative Diseases: A Review on MRI Methods and Insights.,"Perivascular spaces (PVS) and blood-brain barrier (BBB) disruption are two key features of cerebral small vessel disease (cSVD) and neurodegenerative diseases that have been linked to cognitive impairment and are involved in the cerebral waste clearance system. Magnetic resonance imaging (MRI) offers the possibility to study these pathophysiological processes noninvasively in vivo. This educational review provides an overview of the MRI techniques used to assess PVS functionality and BBB disruption. MRI-visible PVS can be scored on structural images by either (subjectively) counting or (automatically) delineating the PVS. We highlight emerging (diffusion) techniques to measure proxies of perivascular fluid and its movement, which may provide a more comprehensive understanding of the role of PVS in diseases. For the measurement of BBB disruption, we explain the most commonly used MRI technique, dynamic contrast-enhanced (DCE) MRI, as well as a more recently developed technique based on arterial spin labeling (ASL). DCE MRI and ASL are thought to measure complementary characteristics of the BBB. Furthermore, we describe clinical studies that have utilized these MRI techniques in cSVD and neurodegenerative diseases, particularly Alzheimer's disease (AD). These studies demonstrate the role of PVS and BBB dysfunction in these diseases and provide insight into the large overlap, but also into the differences between cSVD and AD. Overall, MRI techniques may provide valuable insights into the pathophysiological mechanisms underlying these diseases and have the potential to be used as markers for disease progression and treatment response. LEVEL OF EVIDENCE: 3 TECHNICAL EFFICACY: Stage 2.",2024,Alzheimer's disease; blood-brain barrier breakdown; brain clearance; cerebral small vessel disease; magnetic resonance imaging; perivascular spaces,Humans; Blood-Brain Barrier; Neurodegenerative Diseases; Magnetic Resonance Imaging; Alzheimer Disease; Cognitive Dysfunction; Vascular Diseases,"Voorter, PHM; van Dinther, M; Jansen, WJ; Postma, AA; Staals, J; Jansen, JFA; van Oostenbrugge, RJ; van der Thiel, MM; Backes, WH"
Economic evaluations of electronic health interventions for people with age-related cognitive impairment and their caregivers: A systematic review.,"Dementia has physical, social and economic impacts, causing considerable distress for people with age-related cognitive impairment (PWACI) and their caregivers. Electronic health (e-health) interventions can provide convenient education to improve the coping competence of caregivers and have become an important approach to supporting them. Understanding the economic evidence of e-health interventions will facilitate the decision making and implementation of integrating e-health into routine health services. The present review aimed to appraise economic evidence related to e-health interventions for PWACI and their caregivers.",2023,caregiver; cognitive dysfunction; dementia; economic evaluation; systematic review,Humans; Cost-Benefit Analysis; Caregivers; Cost-Effectiveness Analysis; Cognitive Dysfunction; Electronics,"Zhao, Q; Li, C; Zhang, Y; Tang, HT; Wang, J; Yu, XH; Zhao, Y; Xing, Y; Yu, J; Ye, J; Shan, EF; Li, XW"
Head-to-Head Comparison of Two Plasma Phospho-tau Assays in Predicting Conversion of Mild Cognitive Impairment to Dementia.,"Among blood biomarkers, phospho-tau181 (pTau181) is one of the most efficient in detecting Alzheimer disease across its continuum. However, transition from research to routine clinical use will require confirmation of clinical performance in prospective cohorts and evaluation of cofounding factors.",2023,,Humans; Alzheimer Disease; Prospective Studies; Plasma; Adiponectin; Cognitive Dysfunction,"Lehmann, S; Schraen-Maschke, S; Vidal, JS; Delaby, C; Blanc, F; Paquet, C; Allinquant, B; Bombois, S; Gabelle, A; Hanon, O"
Automating Rey Complex Figure Test scoring using a deep learning-based approach: a potential large-scale screening tool for cognitive decline.,"The Rey Complex Figure Test (RCFT) has been widely used to evaluate the neurocognitive functions in various clinical groups with a broad range of ages. However, despite its usefulness, the scoring method is as complex as the figure. Such a complicated scoring system can lead to the risk of reducing the extent of agreement among raters. Although several attempts have been made to use RCFT in clinical settings in a digitalized format, little attention has been given to develop direct automatic scoring that is comparable to experienced psychologists. Therefore, we aimed to develop an artificial intelligence (AI) scoring system for RCFT using a deep learning (DL) algorithm and confirmed its validity.",2023,Alzheimer’s disease; Artificial intelligence; Convolutional neural network; Deep learning; Rey Complex Figure Test; Scoring,Humans; Artificial Intelligence; Deep Learning; Cognitive Dysfunction; Algorithms; Alzheimer Disease,"Park, JY; Seo, EH; Yoon, HJ; Won, S; Lee, KH"
Methods of a Study to Assess the Contribution of Cerebral Small Vessel Disease and Dementia Risk Alleles to Racial Disparities in Vascular Cognitive Impairment and Dementia.,"Background Non-Hispanic Black adults have a higher proportion of vascular cognitive impairment and Alzheimer's disease and related dementias compared with non-Hispanic White adults that may be due to differences in the burden of cerebral small vessel disease and risk alleles for Alzheimer's disease and related dementias. We describe here the methods of an ancillary study to the REGARDS (Reason for Geographic and and Racial Difference in Stroke) study, which will examine the role of magnetic resonance imaging markers of cerebral small vessel disease and vascular as well as genetic risk factors for Alzheimer's disease and related dementias in racial disparity in the prevalence and trajectory of vascular cognitive impairment and dementia in non-Hispanic White and non-Hispanic Black participants. Methods In participants with no prior history of stroke who had an incident stroke or transient ischemic attack after enrollment in the study, magnetic resonance imaging scans will be evaluated using the Standards for Reporting Vascular Changes on Neuroimaging international consensus criteria and automated analysis pipelines for quantification of cerebral small vessel disease. Participants will be genotyped for ",2023,cerebral small vessel disease; cognitive impairment; dementia; racial disparities; stroke,"Adult; Humans; Alleles; Ischemic Attack, Transient; Alzheimer Disease; Cognitive Dysfunction; Stroke; Cerebral Small Vessel Diseases","Sawyer, RP; Worrall, BB; Howard, VJ; Crowe, MG; Howard, G; Hyacinth, HI"
Dementia prediction in the general population using clinically accessible variables: a proof-of-concept study using machine learning. The AGES-Reykjavik study.,"Early identification of dementia is crucial for prompt intervention for high-risk individuals in the general population. External validation studies on prognostic models for dementia have highlighted the need for updated models. The use of machine learning in dementia prediction is in its infancy and may improve predictive performance. The current study aimed to explore the difference in performance of machine learning algorithms compared to traditional statistical techniques, such as logistic and Cox regression, for prediction of all-cause dementia. Our secondary aim was to assess the feasibility of only using clinically accessible predictors rather than MRI predictors.",2023,Dementia; Machine learning; Prediction model,Humans; Female; Aged; Male; Proof of Concept Study; Machine Learning; Supervised Machine Learning; Algorithms; Dementia,"Twait, EL; Andaur Navarro, CL; Gudnason, V; Hu, YH; Launer, LJ; Geerlings, MI"
Validating ASHS-T1 automated entorhinal and transentorhinal cortical segmentation in Alzheimer's disease.,"The current study aimed to validate entorhinal and transentorhinal cortical volumes measured by the automated segmentation tool Automatic Segmentation of Hippocampal Subfields (ASHS-T1). The study sample comprised 34 healthy controls (HCs), 37 individuals with amnestic mild cognitive impairment (aMCI), and 29 individuals with Alzheimer's disease (AD) dementia from the Alzheimer's Disease Neuroimaging Initiative (ADNI) database. Entorhinal and transentorhinal cortical volumes were assessed using ASHS-T1, manual segmentation, as well as a widely used automated segmentation tool, FreeSurfer v6.0.1. Mean differences, intraclass correlation coefficients, and Bland-Altman plots were computed. ASHS-T1 tended to underestimate entorhinal and transentorhinal cortical volumes relative to manual segmentation and FreeSurfer. There was variable consistency and low agreement between ASHS-T1 and manual segmentation volumes. There was low-to-moderate consistency and low agreement between ASHS-T1 and FreeSurfer volumes. There was a trend toward higher consistency and agreement for the entorhinal cortex in the aMCI and AD groups compared to the HC group. Despite the differences in volume measurements, ASHS-T1 was sensitive to entorhinal and transentorhinal cortical atrophy in both early and late disease stages. Based on the current study, ASHS-T1 appears to be a promising tool for automated entorhinal and transentorhinal cortical volume measurement in individuals with likely underlying AD.",2023,Alzheimer's disease; Automated segmentation; Entorhinal cortex; Magnetic resonance imaging; Manual segmentation; Transentorhinal cortex,"Humans; Alzheimer Disease; Image Processing, Computer-Assisted; Magnetic Resonance Imaging; Hippocampus; Entorhinal Cortex","Quek, YE; Bourgeat, P; Fung, YL; Vogrin, SJ; Collins, SJ; Bowden, SC"
Naïve Bayes classifier assisted automated detection of cerebral microbleeds in susceptibility-weighted imaging brain images.,"Cerebral microbleeds (CMBs) in the brain are the essential indicators of critical brain disorders such as dementia and ischemic stroke. Generally, CMBs are detected manually by experts, which is an exhaustive task with limited productivity. Since CMBs have complex morphological nature, manual detection is prone to errors. This paper presents a machine learning-based automated CMB detection technique in the brain susceptibility-weighted imaging (SWI) scans based on statistical feature extraction and classification. The proposed method consists of three steps: (1) removal of the skull and extraction of the brain; (2) thresholding for the extraction of initial candidates; and (3) extracting features and applying classification models such as random forest and naïve Bayes classifiers for the detection of true positive CMBs. The proposed technique is validated on a dataset consisting of 20 subjects. The dataset is divided into training data that consist of 14 subjects with 104 microbleeds and testing data that consist of 6 subjects with 63 microbleeds. We were able to achieve 85.7% sensitivity using the random forest classifier with 4.2 false positives per CMB, and the naïve Bayes classifier achieved 90.5% sensitivity with 5.5 false positives per CMB. The proposed technique outperformed many state-of-the-art methods proposed in previous studies.",2023,brain bleeds; cerebral microbleeds; hemosiderin deposits; naïve Bayes classifier; random forest classifier,"Humans; Cerebral Hemorrhage; Bayes Theorem; Image Interpretation, Computer-Assisted; Magnetic Resonance Imaging; Brain","Ateeq, T; Faheem, ZB; Ghoneimy, M; Ali, J; Li, Y; Baz, A"
Automatic Detection of Putative Mild Cognitive Impairment from Speech Acoustic Features in Mandarin-Speaking Elders.,"To date, the reliable detection of mild cognitive impairment (MCI) remains a significant challenge for clinicians. Very few studies investigated the sensitivity of acoustic features in detecting Mandarin-speaking elders at risk for MCI, defined as ""putative MCI"" (pMCI).",2023,Alzheimer’s disease; Mandarin; machine learning; mild cognitive impairment; speech,Humans; Aged; Alzheimer Disease; Speech Acoustics; Cognitive Dysfunction; Speech; Acoustics,"Wang, R; Kuang, C; Guo, C; Chen, Y; Li, C; Matsumura, Y; Ishimaru, M; Van Pelt, AJ; Chen, F"
"Microglial morphometric analysis: so many options, so little consistency.","Quantification of microglial activation through morphometric analysis has long been a staple of the neuroimmunologist's toolkit. Microglial morphological phenomics can be conducted through either manual classification or constructing a digital skeleton and extracting morphometric data from it. Multiple open-access and paid software packages are available to generate these skeletons via semi-automated and/or fully automated methods with varying degrees of accuracy. Despite advancements in methods to generate morphometrics (quantitative measures of cellular morphology), there has been limited development of tools to analyze the datasets they generate, in particular those containing parameters from tens of thousands of cells analyzed by fully automated pipelines. In this review, we compare and critique the approaches using cluster analysis and machine learning driven predictive algorithms that have been developed to tackle these large datasets, and propose improvements for these methods. In particular, we highlight the need for a commitment to ",2023,cellular morphological changes; hierarchical cluster analysis; machine learning; microglia; microglia morphology; neuroimmune methods,,"Reddaway, J; Richardson, PE; Bevan, RJ; Stoneman, J; Palombo, M"
Novel Screening Tool Using Non-linguistic Voice Features Derived from Simple Phrases to Detect Mild Cognitive Impairment and Dementia.,"Appropriate intervention and care in detecting cognitive impairment early are essential to effectively prevent the progression of cognitive deterioration. Diagnostic voice analysis is a noninvasive and inexpensive screening method that could be useful for detecting cognitive deterioration at earlier stages such as mild cognitive impairment. We aimed to distinguish between patients with dementia or mild cognitive impairment and healthy controls by using purely acoustic features (i.e., nonlinguistic features) extracted from two simple phrases. Voice was analyzed on 195 recordings from 150 patients (age, 45-95 years). We applied a machine learning algorithm (LightGBM; Microsoft, Redmond, WA, USA) to test whether the healthy control, mild cognitive impairment, and dementia groups could be accurately classified, based on acoustic features. Our algorithm performed well: area under the curve was 0.81 and accuracy, 66.7% for the 3-class classification. Thus, our vocal biomarker is useful for automated assistance in diagnosing early cognitive deterioration.",2023,Mild cognitive impairment; cognitive disorders; diagnosis; machine learning; vocal biomarker,,"Mizuguchi, D; Yamamoto, T; Omiya, Y; Endo, K; Tano, K; Oya, M; Takano, S"
Segmenting white matter hyperintensities on isotropic three-dimensional Fluid Attenuated Inversion Recovery magnetic resonance images: Assessing deep learning tools on a Norwegian imaging database.,"An important step in the analysis of magnetic resonance imaging (MRI) data for neuroimaging is the automated segmentation of white matter hyperintensities (WMHs). Fluid Attenuated Inversion Recovery (FLAIR-weighted) is an MRI contrast that is particularly useful to visualize and quantify WMHs, a hallmark of cerebral small vessel disease and Alzheimer's disease (AD). In order to achieve high spatial resolution in each of the three voxel dimensions, clinical MRI protocols are evolving to a three-dimensional (3D) FLAIR-weighted acquisition. The current study details the deployment of deep learning tools to enable automated WMH segmentation and characterization from 3D FLAIR-weighted images acquired as part of a national AD imaging initiative. Based on data from the ongoing Norwegian Disease Dementia Initiation (DDI) multicenter study, two 3D models-one off-the-shelf from the NVIDIA nnU-Net framework and the other internally developed-were trained, validated, and tested. A third cutting-edge Deep Bayesian network model (HyperMapp3r) was implemented without any de-novo tuning to serve as a comparison architecture. The 2.5D in-house developed and 3D nnU-Net models were trained and validated in-house across five national collection sites among 441 participants from the DDI study, of whom 194 were men and whose average age was (64.91 +/- 9.32) years. Both an external dataset with 29 cases from a global collaborator and a held-out subset of the internal data from the 441 participants were used to test all three models. These test sets were evaluated independently. The ground truth human-in-the-loop segmentation was compared against five established WMH performance metrics. The 3D nnU-Net had the highest performance out of the three tested networks, outperforming both the internally developed 2.5D model and the SOTA Deep Bayesian network with an average dice similarity coefficient score of 0.76 +/- 0.16. Our findings demonstrate that WMH segmentation models can achieve high performance when trained exclusively on FLAIR input volumes that are 3D volumetric acquisitions. Single image input models are desirable for ease of deployment, as reflected in the current embedded clinical research project. The 3D nnU-Net had the highest performance, which suggests a way forward for our need to automate WMH segmentation while also evaluating performance metrics during on-going data collection and model retraining.",2023,,Male; Humans; Middle Aged; Aged; Female; Bayes Theorem; Deep Learning; White Matter; Magnetic Resonance Imaging; Neuroimaging; Leukoaraiosis; Alzheimer Disease,"Røvang, MS; Selnes, P; MacIntosh, BJ; Rasmus Groote, I; Pålhaugen, L; Sudre, C; Fladby, T; Bjørnerud, A"
Qualitative Evaluation of Family Caregivers' Experiences Participating in Knowledge and Interpersonal Skills to Develop Exemplary Relationships (KINDER): Web-Based Intervention to Improve Relationship Quality.,"The onset of Alzheimer disease and related dementias (AD/ADRD) can alter relationships between family caregivers and persons living with AD/ADRD, such as through the occurrence of distressful behavioral and psychological symptoms of dementia. Poorly perceived relationship quality by caregivers contributes to negative outcomes for both care partners, such as low-quality caregiving and potential mistreatment of older adults. Knowledge and Interpersonal Skills to Develop Exemplary Relationships (KINDER) is a new, web-based, asynchronous psychoeducational intervention with content informed by focus groups with family caregivers. The program was developed to prevent low-quality caregiving and potential mistreatment of older adults by focusing on building healthy caregiving relationships.",2023,Alzheimer; Alzheimer’s; aging; caregiver; caregiving; dementia: digital health; digital intervention; family care; informal care; intervention; older adult; quality of care,,"Meyer, K; Gonzalez, A; Benton, D"
Acoustic stimulation as a promising technique to enhance slow-wave sleep in Alzheimer's disease: results of a pilot study.,"Sleep disturbances are common in people with Alzheimer's disease (AD), and a reduction in slow-wave activity is the most striking underlying change. Acoustic stimulation has emerged as a promising approach to enhance slow-wave activity in healthy adults and people with amnestic mild cognitive impairment. In this phase 1 study we investigated, for the first time, the feasibility of acoustic stimulation in AD and piloted the effect on slow-wave sleep (SWS).",2023,Alzheimer’s disease; acoustic stimulation; sleep; slow-wave sleep; wearable device,"Adult; Humans; Sleep, Slow-Wave; Acoustic Stimulation; Pilot Projects; Alzheimer Disease; Electroencephalography; Sleep","Van den Bulcke, L; Peeters, AM; Heremans, E; Davidoff, H; Borzée, P; De Vos, M; Emsell, L; Van den Stock, J; De Roo, M; Tournoy, J; Buyse, B; Vandenbulcke, M; Van Audenhove, C; Testelmans, D; Van Den Bossche, M"
